Article Source,Data Source,Data nature,Tool and Technology,Preprocessing,Tasks,Development environment,Techniques,Metrics,Repository,Event
"Silva, N.F.F.d. et al. (2021). Evaluating Topic Models in Portuguese Political Comments About Bills from Brazil’s Chamber of Deputies. In: Britto, A., Valdivia Delgado, K. (eds) Intelligent Systems. BRACIS 2021. Lecture Notes in Computer Science(), vol 13074. Springer, Cham. https://doi.org/10.1007/978-3-030-91699-2_8",Câmara dos Deputados,corpus já disponível,Não descrito,Não descrito,"clusterização, modelagem de tópicos, sumarização, classificação (treinamento e teste de dados)",Python,"BERTopic, word embeddings, HDBSCAN, TF-IDF, bert, bertimbau, c-tf-idf, SimCSE","NPMI, coerência","https://github.com/nadiafelix/Bracis2021/tree/main/LegalSentenceBertPT
https://github.com/MaartenGr/BERTopic
https://github.com/princeton-nlp/SimCSE",BRACIS_2021
"Oliveira, L.E.S.e., Schneider, E.T.R., Gumiel, Y.B., Luz, M.A.P.d., Paraiso, E.C., Moro, C. (2021). Experiments on Portuguese Clinical Question Answering. In: Britto, A., Valdivia Delgado, K. (eds) Intelligent Systems. BRACIS 2021. Lecture Notes in Computer Science(), vol 13074. Springer, Cham. https://doi.org/10.1007/978-3-030-91699-2_10",Wikipedia,corpus já disponível,Não descrito,"Remoção (espaços, textos duplicados), tokenização",recuperação de informação,Python,"BERT, Named Entity Recognition (NER), BioBERTpt","Precisão, revocação, f1-score",Não descrito,BRACIS_2021
"Barros, J.M., De Bona, G. (2021). A Deep Learning Approach for Aspect Sentiment Triplet Extraction in Portuguese. In: Britto, A., Valdivia Delgado, K. (eds) Intelligent Systems. BRACIS 2021. Lecture Notes in Computer Science(), vol 13074. Springer, Cham. https://doi.org/10.1007/978-3-030-91699-2_24",TripAdvisor,corpus construído/coletado,Não descrito,"tokenização, redução de dimensionalidade","classificação (extração de características, identificação de sentenças, extração de aspectos, identificação de polaridade, análise de sentimentos)",Python,"BERT, glove, Aspect Sentiment Triplet Extraction (ASTE), WordPiece, BiLSTM-CRF, LSTM, Shapiro-Wilk, Friedman e Nemeyi test, word embeddings","f1-score, revocação, validação cruzada",https://github.com/josemelendezb/bote,BRACIS_2021
"Mamani-Condori, E., Ochoa-Luna, J. (2021). Aggressive Language Detection Using VGCN-BERT for Spanish Texts. In: Britto, A., Valdivia Delgado, K. (eds) Intelligent Systems. BRACIS 2021. Lecture Notes in Computer Science(), vol 13074. Springer, Cham. https://doi.org/10.1007/978-3-030-91699-2_25",Twitter,corpus já disponível,"nltk, tweetTokenizer, scikit-learn","Remoção (simbolos, caracteres especiais), tokenização, lowercasing",classificação (extração de características),Python,"BERT, Vocabulary Graph Convolutional Network (VGCN), word embeddings, Bag-of-Words (BoW), Support Vector Machine (SVM), TF, TF-IDF, BiLSTM-CRF","NPMI, f1-score, precisão, revocação",Não descrito,BRACIS_2021
"de Oliveira, M., de Melo, T. (2021). An Empirical Study of Text Features for Identifying Subjective Sentences in Portuguese. In: Britto, A., Valdivia Delgado, K. (eds) Intelligent Systems. BRACIS 2021. Lecture Notes in Computer Science(), vol 13074. Springer, Cham. https://doi.org/10.1007/978-3-030-91699-2_26",TripAdvisor,corpus já disponível,"spacy, Scikit-Learn","Pos tagging, tokenização","classificação (extração de características, identificação de polaridade, identificação de classes gramaticais)",Python,"Support Vector Machine (SVM), Gradient Boosting Trees (GBT), Random Forest (RF), Maximum Entropy (ME), AutoML, AutoGluon, Part-of-Speech tags (POS tags), Universal Dependencies (UD), Recursive Feature Elimination (RFE)","precisão, revocação, f1-score, acurácia, validação cruzada",Não descrito,BRACIS_2021
"Andrade Junior, J.E., Cardoso-Silva, J., Bezerra, L.C.T. (2021). Comparing Contextual Embeddings for Semantic Textual Similarity in Portuguese. In: Britto, A., Valdivia Delgado, K. (eds) Intelligent Systems. BRACIS 2021. Lecture Notes in Computer Science(), vol 13074. Springer, Cham. https://doi.org/10.1007/978-3-030-91699-2_27","ASSIN, ASSIN2",corpus já disponível,Não descrito,Não descrito,classificação (treinamento e teste de dados),Python,"BERT, SBERT, word embeddings, bertimbau",F1-score,Não descrito,BRACIS_2021
"Neto, J.R.C.S.A.V.S., Faleiros, T.d.P. (2021). Deep Active-Self Learning Applied to Named Entity Recognition. In: Britto, A., Valdivia Delgado, K. (eds) Intelligent Systems. BRACIS 2021. Lecture Notes in Computer Science(), vol 13074. Springer, Cham. https://doi.org/10.1007/978-3-030-91699-2_28",Diário Oficial do DF,corpus já disponível,Pytorch,Não descrito,classificação (treinamento e teste de dados),"Colab, Python","Named Entity Recognition (NER), CNN, LSTM, BiLSTM-CRF",Maximum Normalized Log-Probability (MNLP),Não descrito,BRACIS_2021
"Cação, F.N., José, M.M., Oliveira, A.S., Spindola, S., Costa, A.H.R., Cozman, F.G. (2021). DEEPAGÉ: Answering Questions in Portuguese About the Brazilian Environment. In: Britto, A., Valdivia Delgado, K. (eds) Intelligent Systems. BRACIS 2021. Lecture Notes in Computer Science(), vol 13074. Springer, Cham. https://doi.org/10.1007/978-3-030-91699-2_29","Wikipedia, folha de sao paulo, Estadao, O Globo",corpus construído/coletado,Não descrito,"remoção (caracteres especiais, quebras de linha, outliers)",classificação (treinamento e teste de dados),Python,"question answering (QA), PTT5, T5, Okapi BM25","Exact Match, F1-Score, rouge",https://github.com/C4AI/deepage,BRACIS_2021
"Consoli, B.S., Vieira, R. (2021). Enriching Portuguese Word Embeddings with Visual Information. In: Britto, A., Valdivia Delgado, K. (eds) Intelligent Systems. BRACIS 2021. Lecture Notes in Computer Science(), vol 13074. Springer, Cham. https://doi.org/10.1007/978-3-030-91699-2_30","Wikipedia, ASSIN",corpus já disponível,NILC,Não descrito,"classificação (treinamento e teste de dados), concatenação, tradução",Python,"word embeddings, word2vec, fasttext, NILC, Neural Network (NN), otimizador adamw, Word Relatedness, Analogy Prediction, Sentence Textual Similarity (STS), Named Entity Recognition (NER), TF-IDF, LSTM","Pearson, Mean squared error (MSE), Spearman, similaridade de cosseno","https://github.com/bsconsoli/Enriching-Portuguese-Word-Embeddings-with-Visual-Information
https://github.com/nathanshartmann/portuguese_word_embeddings",BRACIS_2021
"Reyes, D.D.L., Trajano, D., Manssour, I.H., Vieira, R., Bordini, R.H. (2021). Entity Relation Extraction from News Articles in Portuguese for Competitive Intelligence Based on BERT. In: Britto, A., Valdivia Delgado, K. (eds) Intelligent Systems. BRACIS 2021. Lecture Notes in Computer Science(), vol 13074. Springer, Cham. https://doi.org/10.1007/978-3-030-91699-2_31","Estadão Economia, UOL, G1, O Globo",corpus construído/coletado,"Hugging face, Excel, spacy, TensorFlow Keras","remoção (caracteres especiais), limpeza dos dados","Classificação (identificação de entidades, treinamento e teste de dados, rotulagem de dados, identificação de sentenças) ",Python,"Bert, otimizador adamw",Coeficiente de similaridade de Jaccard,Não descrito,BRACIS_2021
"Lima, B., Nogueira, T. (2021). Incorporating Text Specificity into a Convolutional Neural Network for the Classification of Review Perceived Helpfulness. In: Britto, A., Valdivia Delgado, K. (eds) Intelligent Systems. BRACIS 2021. Lecture Notes in Computer Science(), vol 13074. Springer, Cham. https://doi.org/10.1007/978-3-030-91699-2_33",Amazon,corpus construído/coletado,"spacy, Tensorflow, Keras, scikit-learn","Remoção (simbolos, caracteres especiais), lemmatization, unigramas","classificação (extração de características, treinamento e teste de dados)",Python,"word embeddings, biLSTM-CRF, CNN, Friedman e Nemeyi test, otimizador adamw, glove, Support Vector Machine (SVM), tf-idf","validação cruzada, Cross Entropy, Mean squared error (MSE), sigmoid, F1-Score",Não descrito,BRACIS_2021
"Sacramento, A.d.S.B., Souza, M. (2021). Joint Event Extraction with Contextualized Word Embeddings for the Portuguese Language. In: Britto, A., Valdivia Delgado, K. (eds) Intelligent Systems. BRACIS 2021. Lecture Notes in Computer Science(), vol 13074. Springer, Cham. https://doi.org/10.1007/978-3-030-91699-2_34",não descrito,corpus construído/coletado,Não descrito,tokenização,"recuperação de informação, classificação (treinamento e teste de dados, rotulagem de dados, identificação de sentenças), Open Information Extraction (OIE)",Python,"bertimbau, bert, word embeddings, LSTM, BiLSTM-CRF, BIO, blstme","cross entropy, Coeficiente Kappa de Cohen, Precisão, F1-Score, Revocação, validação cruzada",Não descrito,BRACIS_2021
"Silva, D.F. et al. (2021). Named Entity Recognition for Brazilian Portuguese Product Titles. In: Britto, A., Valdivia Delgado, K. (eds) Intelligent Systems. BRACIS 2021. Lecture Notes in Computer Science(), vol 13074. Springer, Cham. https://doi.org/10.1007/978-3-030-91699-2_36",e-commerce,corpus construído/coletado,"scikit-learn, Prodigy","remoção (outliers, caracteres especiais, stopwords, textos duplicados), tokenização, lowercasing","classificação (extração de características, treinamento e teste de dados, identificação de entidades), clusterização, recuperação de informação",Python,"Named Entity Recognition (NER), MITIE, BERT, tf-idf, k-means (KM), bertimbau, LSTM","f1-score, Método elbow (cotovelo)",Não descrito,BRACIS_2021
"de Lima, T.B., Nascimento, A.C.A., Valença, G., Miranda, P., Mello, R.F., Si, T. (2021). Portuguese Neural Text Simplification Using Machine Translation. In: Britto, A., Valdivia Delgado, K. (eds) Intelligent Systems. BRACIS 2021. Lecture Notes in Computer Science(), vol 13074. Springer, Cham. https://doi.org/10.1007/978-3-030-91699-2_37",bíblia,corpus já disponível,"pylinguistic, OpenNMT",Não descrito,tradução,Não descrito,"Neural Machine Translation (NMT), statistical machine translation (SMT), RNN, bert, B-RNN, otimizador adamw, word embeddings","bleu, readability ease (FRE), SARI",Não descrito,BRACIS_2021
"Aragy, R., Fernandes, E.R., Caceres, E.N. (2021). Rhetorical Role Identification for Portuguese Legal Documents. In: Britto, A., Valdivia Delgado, K. (eds) Intelligent Systems. BRACIS 2021. Lecture Notes in Computer Science(), vol 13074. Springer, Cham. https://doi.org/10.1007/978-3-030-91699-2_38",TJMS,corpus construído/coletado,"PDFBox, nltk, Hugging Face, scikit-learn, keras","remoção (stopwords), tokenização","classificação (identificação de sentenças, treinamento e teste de dados), visualização (matriz de confusão)",Python,"Bert, Tf-idf, Naive Bayes (NB), Support Vector Machine (SVM), Bag-of-Words (BoW), bertimbau, Multi-Layer Perceptron (MLP), otimizador adamw",F1-score,Não descrito,BRACIS_2021
"Aguiar, A., Silveira, R., Pinheiro, V., Furtado, V., Neto, J.A. (2021). Text Classification in Legal Documents Extracted from Lawsuits in Brazilian Courts. In: Britto, A., Valdivia Delgado, K. (eds) Intelligent Systems. BRACIS 2021. Lecture Notes in Computer Science(), vol 13074. Springer, Cham. https://doi.org/10.1007/978-3-030-91699-2_40",tjce,corpus construído/coletado,Scikit-learn,"remoção (caracteres especiais, espaços)","concatenação, modelagem de tópicos, classificação (extração de características, treinamento e teste de dados), visualização (matriz de confusão)",Python,"Named Entity Recognition (NER), optical character recognition (OCR), Teoria dos Grafos, bert, bertimbau, word embeddings, tf-idf, Bag-of-Words (BoW), LDA, Support Vector Machine (SVM), Random Forest (RF), XGBoost, otimizador adamw, Kruskal-Wallis test",F1-score,Não descrito,BRACIS_2021
"Lopes, L., Duran, M.S., Pardo, T.A.S. (2021). Universal Dependencies-Based PoS Tagging Refinement Through Linguistic Resources. In: Britto, A., Valdivia Delgado, K. (eds) Intelligent Systems. BRACIS 2021. Lecture Notes in Computer Science(), vol 13074. Springer, Cham. https://doi.org/10.1007/978-3-030-91699-2_41",Folha de Sao Paulo,corpus já disponível,Não descrito,PoS tagging,"classificação (rotulagem de dados, identificação de classes gramaticais, anotação morfossintática, treinamento e teste de dados)",Python,"Part-of-Speech tags (POS tags), UDPipe, Universal Dependencies (UD)",acurácia,https://sites.google.com/icmc.usp.br/poetisa,BRACIS_2021
"Privatto, P.I.M., Guilherme, I.R. (2021). When External Knowledge Does Not Aggregate in Named Entity Recognition. In: Britto, A., Valdivia Delgado, K. (eds) Intelligent Systems. BRACIS 2021. Lecture Notes in Computer Science(), vol 13074. Springer, Cham. https://doi.org/10.1007/978-3-030-91699-2_42",Não descrito,corpus já disponível,OpenKE,Não descrito,"Classificação (treinamento e teste de dados, identificação de sentenças, identificação de entidades)",Não descrito,"Named Entity Recognition (NER), BiLSTM-CRF, BiGRU-CRF, LSTM, word embeddings, CNN, bert, glove, TransE method","f1-score, precisão, revocação",Não descrito,BRACIS_2021
"da Rocha Bartolomei, B., Drummond, I.N. (2020). Authorship Attribution of Brazilian Literary Texts Through Machine Learning Techniques. In: Cerri, R., Prati, R.C. (eds) Intelligent Systems. BRACIS 2020. Lecture Notes in Computer Science(), vol 12319. Springer, Cham. https://doi.org/10.1007/978-3-030-61377-8_27",Não descrito,corpus já disponível,"nltk, imbalanced-learn, scikit-learn","bigramas, PoS tagging","sumarização, classificação (extração de características, balanceamento de dados, identificação de classes gramaticais), visulaização (matriz de confusão)","Colab, Python","TextRank, TF-IDF, Part-of-Speech tags (POS tags), RandomOverSampler, random forest (rf), naive bayes (NB)",validação cruzada,Não descrito,BRACIS_2020
"Souza, F., Nogueira, R., Lotufo, R. (2020). BERTimbau: Pretrained BERT Models for Brazilian Portuguese. In: Cerri, R., Prati, R.C. (eds) Intelligent Systems. BRACIS 2020. Lecture Notes in Computer Science(), vol 12319. Springer, Cham. https://doi.org/10.1007/978-3-030-61377-8_28",ASSiN2,corpus já disponível,"ftfy, WordPiece","remoção (tags html), tokenização","classificação (treinamento e teste de dados, identificação de entidades, identificação de classes gramaticais), concatenção",Python,"Deeper transfer learning, bert, elmo, flair embeddings, bertimbau, Named Entity Recognition (NER), Recognizing Textual Entailment (RTE), Sentence Textual Similarity (STS), otimizador adamw, BERT multilingual (M-BERT), LSTM, BiLSTM-CRF, word embeddings","Mean Squared Error (MSE), F1-score, Pearson, acurácia, Precisão, Acurácia",https://github.com/neuralmind-ai/portuguese-bert,BRACIS_2020
"Lochter, J.V., Silva, R.M., Almeida, T.A. (2020). Deep Learning Models for Representing Out-of-Vocabulary Words. In: Cerri, R., Prati, R.C. (eds) Intelligent Systems. BRACIS 2020. Lecture Notes in Computer Science(), vol 12319. Springer, Cham. https://doi.org/10.1007/978-3-030-61377-8_29",twitter,corpus já disponível,"transformers, keras, tensorflow","remoção (retweets), Pos tagging, lowercasing","classificação (treinamento e teste de dados, identificação de entidades, identificação de classes gramaticais)",Python,"word embeddings, LSTM, Roberta, Distilbert, electra, named entity recognition (NER), FastText, GPT2, HiCE, Comick, LSTM, BiLSTM-CRF, Part-of-Speech tags (POS tags), bert","similaridade de cosseno, Spearman, F1-Score, acurácia",Não descrito,BRACIS_2020
"Maier Ferreira, T., Reali Costa, A.H. (2020). DeepBT and NLP Data Augmentation Techniques: A New Proposal and a Comprehensive Study. In: Cerri, R., Prati, R.C. (eds) Intelligent Systems. BRACIS 2020. Lecture Notes in Computer Science(), vol 12319. Springer, Cham. https://doi.org/10.1007/978-3-030-61377-8_30","Twitter, stocktwits",corpus já disponível,Não descrito,"remoção (stopwords, pontuações), tokenização, lowercasing","tradução, classificação (treinamento e teste de dados)",Python,"Easy Data Augmentation (EDA), CNN, otimizador adamw, glove, word embeddings","Mean Squared Error (MSE), validação cruzada",Não descrito,BRACIS_2020
"Sakiyama, K., de Souza Rodrigues, L., Matsubara, E.T. (2020). Can Twitter Data Estimate Reality Show Outcomes?. In: Cerri, R., Prati, R.C. (eds) Intelligent Systems. BRACIS 2020. Lecture Notes in Computer Science(), vol 12319. Springer, Cham. https://doi.org/10.1007/978-3-030-61377-8_32",twitter,corpus construído/coletado,scikit-learn,"remoção (números, caracteres especiais, links)","classificação (análise de sentimentos, identificação de polaridade, extração de características, treinamento e teste de dados), visualização (matriz de confusão)",Python,"bert, glue, bilstm-crf, cnn, lstm, Support Vector Machine (SVM), naive bayes (nb), K-Nearest Neighbor (KNN), tf-idf, word2vec, fasttext, BERT multilingual (M-BERT), Bag-of-Words (BoW), Random Forest (RF), Logistic Regression (LR), Linear Regression, Support Vector Regressor (SVR), Elastic Net, Ridge, Lasso, Stochastic Gradient Descent (SGD), Decision Tree Classifier (DTC), AdaBoost (AB), grid search","validação cruzada, Pearson, acurácia, precisão, revocação, F1-Score, mean squared error (MSE), erro absoluto medio (mae)",Não descrito,BRACIS_2020
"Rodrigues, R.C., Rocha, A.S., Inuzuka, M.A., do Nascimento, H.A.D. (2020). Domain Adaptation of Transformers for English Word Segmentation. In: Cerri, R., Prati, R.C. (eds) Intelligent Systems. BRACIS 2020. Lecture Notes in Computer Science(), vol 12319. Springer, Cham. https://doi.org/10.1007/978-3-030-61377-8_33",Wikipedia,corpus construído/coletado,"Wikiextractor, nltk","remoção (tags html, caracteres especiais)",segmentação de palavras,Python,"bert, BiLSTM-CRF, cnn, lstm","f1-score, Revocação, Acurácia",https://github.com/ruanchaves/BERT-WS,BRACIS_2020
"Vargas, F.A., Dos Santos, R.S.S., Rocha, P.R. (2020). Identifying Fine-Grained Opinion and Classifying Polarity on Coronavirus Pandemic. In: Cerri, R., Prati, R.C. (eds) Intelligent Systems. BRACIS 2020. Lecture Notes in Computer Science(), vol 12319. Springer, Cham. https://doi.org/10.1007/978-3-030-61377-8_35",Twitter,corpus construído/coletado,"tweepy, rdflib, beautifulSoup, spacy, scikit-learn",Não descrito,"classificação (identificação de polaridade, análise de sentimentos, rotulagem de dados, extração de características, treinamento e teste de dados)",Python,"Decision Tree Classifier (DTC), Support Vector Machine (SVM), naive bayes (NB), linearSVC","validação cruzada, acurácia, F1-Score, Precisão, Revocação",Não descrito,BRACIS_2020
"Dal Pont, T.R., Sabo, I.C., Hübner, J.F., Rover, A.J. (2020). Impact of Text Specificity and Size on Word Embeddings Performance: An Empirical Evaluation in Brazilian Legal Domain. In: Cerri, R., Prati, R.C. (eds) Intelligent Systems. BRACIS 2020. Lecture Notes in Computer Science(), vol 12319. Springer, Cham. https://doi.org/10.1007/978-3-030-61377-8_36","STF, STJ, TJSC, JusBrasil",corpus construído/coletado,Não descrito,"remoção (caracteres especiais, símbolos), redução de dimensionalidade, lowercasing, stemmization, lemmatization","classificação (extração de características, treinamento e teste de dados), clusterização, sumarização",Python,"cnn, word embeddings, word2vec, glove, Optical Character Recognition (OCR), fasttext, Principal Component Analysis (PCA)","acurácia, F1-Score, Precisão, Revocação",Não descrito,BRACIS_2020
"de Carvalho, V.F., Giacon, B., Nascimento, C., Nogueira, B.M. (2020). Machine Learning for Suicidal Ideation Identification on Twitter for the Portuguese Language. In: Cerri, R., Prati, R.C. (eds) Intelligent Systems. BRACIS 2020. Lecture Notes in Computer Science(), vol 12319. Springer, Cham. https://doi.org/10.1007/978-3-030-61377-8_37",twitter,corpus construído/coletado,Scikit-Learn,"Remoção (pontuações), lowercasing","classificação (extração de características, rotulagem de dados)",Python,"bert, lstm, word embeddings, word2vec, Support Vector Machine (SVM), Bag-of-Words (BoW), multi-layer perceptron (MLP), RNN, word2vec, StratifiedKFold, lstm, otimizador adamw","validação cruzada, acurácia, F1-Score, Precisão, Revocação","https://github.com/viniciosfaustino/tweet-collector
https://github.com/viniciosfaustino/suicide-detection
",BRACIS_2020
"Queiroz Abonizio, H., Barbon Junior, S. (2020). Pre-trained Data Augmentation for Text Classification. In: Cerri, R., Prati, R.C. (eds) Intelligent Systems. BRACIS 2020. Lecture Notes in Computer Science(), vol 12319. Springer, Cham. https://doi.org/10.1007/978-3-030-61377-8_38",Não descrito,corpus já disponível,pytorch,Não descrito,"classificação (extração de características, treinamento e teste de dados), tradução",Python,"DistilGPT2, GPT2, DistilBERT, bert, cnn, lstm, naive bayes (nb), Easy Data Augmentation (EDA), Back-Translation (BT), Friedman e Nemeyi test",acurácia,"https://github.com/hugoabonizio/predator
https://github.com/jasonwei20/eda_nlp",BRACIS_2020
"Reys, A.D., Silva, D., Severo, D., Pedro, S., de Sousa e Sá, M.M., Salgado, G.A.C. (2020). Predicting Multiple ICD-10 Codes from Brazilian-Portuguese Clinical Notes. In: Cerri, R., Prati, R.C. (eds) Intelligent Systems. BRACIS 2020. Lecture Notes in Computer Science(), vol 12319. Springer, Cham. https://doi.org/10.1007/978-3-030-61377-8_39",Syrian-Lebanese Hospital (HSL),corpus construído/coletado,"keras, tensorflow, nltk, Scikit-learn, Gensim","remoção (caracteres especiais, datas, horas, stopwords), lowercasing","classificação (extração de características, treinamento e teste de dados)",Python,"cnn, rnn, logistic regression (LR), tf-idf, word2vec, Bag-of-Words (BoW), grid search, CNN-Att, word embeddings, bilstm, gru, BiGRU","f1-score, revocação, precisão",https://github.com/3778/icd-prediction-mimic,BRACIS_2020
"Gengo, P., Verri, F.A.N. (2020). Correction to: Semi-Supervised Sentiment Analysis of Portuguese Tweets with Random Walk in Feature Sample Networks. In: Cerri, R., Prati, R.C. (eds) Intelligent Systems. BRACIS 2020. Lecture Notes in Computer Science(), vol 12319. Springer, Cham. https://doi.org/10.1007/978-3-030-61377-8_47",twitter,corpus já disponível,Não descrito,"remoção (caracteres especiais, tags html, acentos, menções, hashtags, pontuações), tokenização","classificação (análise de sentimentos, identificação de polaridade)",Python,"Random Walk in Feature-Sample Networks (RWFSN), Bag-of-Words (BoW), K-Nearest Neighbor (KNN)","Coeficiente de similaridade de Jaccard, acurácia, f1-score, Area Under the ROC Curve (AUC)",https://github.com/pedrogengo/RWFSN,BRACIS_2020
"Silva, A.C., Maia, L.C.G. (2020). The Use of Machine Learning in the Classification of Electronic Lawsuits: An Application in the Court of Justice of Minas Gerais. In: Cerri, R., Prati, R.C. (eds) Intelligent Systems. BRACIS 2020. Lecture Notes in Computer Science(), vol 12319. Springer, Cham. https://doi.org/10.1007/978-3-030-61377-8_43",TJMG,corpus construído/coletado,"nltk, Scikit-learn, tensorflow",remoção (stopwords),"classificação (extração de características, treinamento e teste de dados)",Python,"Glove, Neural Network (NN), Randomsearch, naive bayes (nb), Support Vector Machine (SVM), AdaBoost (AB), tf-idf, cnn","F1-Score, Precisão, Revocação, validação cruzada",https://github.com/adrianocapanema/ClassificationOfElectronicLawsuitsAnApplicationInTheTJMG,BRACIS_2020
"Pavan, M.C., dos Santos, W.R., Paraboni, I. (2020). Twitter Moral Stance Classification Using Long Short-Term Memory Networks. In: Cerri, R., Prati, R.C. (eds) Intelligent Systems. BRACIS 2020. Lecture Notes in Computer Science(), vol 12319. Springer, Cham. https://doi.org/10.1007/978-3-030-61377-8_45",twitter,corpus já disponível,Não descrito,unigramas,"classificação (rotulagem de dados, identificação de polaridade, treinamento e teste de dados)",Python,"BiLSTM, LSTM, Analysis of variance (ANOVA), tf-idf",validação cruzada,Não descrito,BRACIS_2020
"Bonifacio, L.H., Vilela, P.A., Lobato, G.R., Fernandes, E.R. (2020). A Study on the Impact of Intradomain Finetuning of Deep Language Models for Legal Named Entity Recognition in Portuguese. In: Cerri, R., Prati, R.C. (eds) Intelligent Systems. BRACIS 2020. Lecture Notes in Computer Science(), vol 12319. Springer, Cham. https://doi.org/10.1007/978-3-030-61377-8_46","Wikipedia, TCU",corpus já disponível,"spacy, seqeval, Transformers, AllenNLP","remoção (tags html, links, pontuações)","classificação (identificação de entidades, treinamento e teste de dados)",Python,"Named Entity Recognition (NER), bert, elmo, BERT multilingual (M-BERT)",F1-score,https://github.com/netoferraz/acordaos-tcu,BRACIS_2020
"Santos, J., Alves, A., Gonçalo Oliveira, H. (2020). Leveraging on Semantic Textual Similarity for Developing a Portuguese Dialogue System. In: Quaresma, P., Vieira, R., Aluísio, S., Moniz, H., Batista, F., Gonçalves, T. (eds) Computational Processing of the Portuguese Language. PROPOR 2020. Lecture Notes in Computer Science(), vol 12037. Springer, Cham. https://doi.org/10.1007/978-3-030-41505-1_13","ASSIN, ASSIN2",corpus já disponível,"nltk, nlppyport, scikit-learn","tokenização, pos tagging, lemmatization, redução de dimensionalidade","Classificação (extração de características, identificação de classes gramaticais, identificação de entidades, treinamento e teste de dados)",não descrito,"Semantic Textual Similarity (STS), Part-of-Speech tags (POS tags), Support Vector Regressor (SVR), word embeddings, word2vec, glove, nilc, fasttext, Named Entity Recognition (NER)","Mean Squared Error (MSE), Pearson, Coeficiente de similaridade de Jaccard, overlap, dice",não descrito,PROPOR_2020
