Article Source,Data Source,Data nature,Tool and Technology,Preprocessing,Tasks,Development environment,Techniques,Metrics,Repository,Event
"MACHADO, Mateus Tarcinalli; PARDO, Thiago Alexandre Salgueiro; RUIZ, Evandro Eduardo Seron; FELIPPO, Ariani Di. Learning rules for automatic identification of implicit aspects in Portuguese. In: SIMPÓSIO BRASILEIRO DE TECNOLOGIA DA INFORMAÇÃO E DA LINGUAGEM HUMANA (STIL), 13. , 2021, Evento Online. Anais [...]. Porto Alegre: Sociedade Brasileira de Computação, 2021 . p. 82-91. DOI: https://doi.org/10.5753/stil.2021.17787",Não descrito,corpus já disponível,Spacy,"Tokenização, PoS tagging","Classificação (análise de sentimentos, treinamento e teste de dados, análise de dependência, identificação de aspectos, identificação de classes gramaticais)",Python,"Freq-Baseline, Word2Vec, SenticNet, Laplace precision","Precisão, Revocação, F1-Score",https://sites.google.com/icmc.usp.br/poetisa,STIL_2021
"EBERHART, Carolina; IGNACZAK, Luciano; MARTINS, Márcio Garcia. Text Mining for Cyberbullying Detection: a Brazilian Portuguese Evaluation. In: SIMPÓSIO BRASILEIRO DE TECNOLOGIA DA INFORMAÇÃO E DA LINGUAGEM HUMANA (STIL), 13. , 2021, Evento Online. Anais [...]. Porto Alegre: Sociedade Brasileira de Computação, 2021 . p. 92-100. DOI: https://doi.org/10.5753/stil.2021.17788",Reddit,corpus construído/coletado,"PRAW3, Scikit-learn",Remoção (emojis),"Classificação (rotulagem de dados, identificação de polaridade, treinamento e teste de dados, balanceamento de dados, extração de características)",Python,"smote, Support Vector Machine (SVM), Naive Bayes (NB)","Precisão, Acurácia, Revocação, F1-Score",https://github.com/ceberhart2611/Cyberbullying-article-2021,STIL_2021
"BARBIRATO, João Gabriel Melo; REAL, Livy; CASELI, Helena de Medeiros. Relation extraction in structured and unstructured data: a comparative investigation on smartphone titles in the e-commerce domain. In: SIMPÓSIO BRASILEIRO DE TECNOLOGIA DA INFORMAÇÃO E DA LINGUAGEM HUMANA (STIL), 13. , 2021, Evento Online. Anais [...]. Porto Alegre: Sociedade Brasileira de Computação, 2021 . p. 101-110. DOI: https://doi.org/10.5753/stil.2021.17789","Americanas, e-commerce",corpus construído/coletado,"Prodigy, hugging face",Não descrito,"Classificação (treinamento e teste de dados, extração de relacionamento)",Python,"BERT, Named Entity Recognition (NER), BERTimbau, BERT multilingual (M-BERT), MTB (Multi-Task BERT)","F1-Score, Acurácia",https://github.com/plkmo/BERT-Relation-Extraction,STIL_2021
"ROMUALDO, Alan da Silva; REAL, Livy; CASELI, Helena de Medeiros. Classificação multimodal para detecção de produtos proibidos em uma plataforma marketplace. In: SIMPÓSIO BRASILEIRO DE TECNOLOGIA DA INFORMAÇÃO E DA LINGUAGEM HUMANA (STIL), 13. , 2021, Evento Online. Anais [...]. Porto Alegre: Sociedade Brasileira de Computação, 2021 . p. 111-120. DOI: https://doi.org/10.5753/stil.2021.17790",e-commerce,corpus construído/coletado,"Keras, FastText","Remoção (stopwords, caracteres especiais, números, links), lowercasing, Concatenação",Classificação (treinamento e teste de dados),Python,"FastText, word embeddings, otimizador AdamW","Similaridade multimodal, Precisão, F1-Score, Revocação, Cross Entropy",Não descrito,STIL_2021
"ROMUALDO, Alan da Silva; REAL, Livy; CASELI, Helena de Medeiros. Measuring Brazilian Portuguese Product Titles Similarity using Embeddings. In: SIMPÓSIO BRASILEIRO DE TECNOLOGIA DA INFORMAÇÃO E DA LINGUAGEM HUMANA (STIL), 13. , 2021, Evento Online. Anais [...]. Porto Alegre: Sociedade Brasileira de Computação, 2021 . p. 121-132. DOI: https://doi.org/10.5753/stil.2021.17791","e-commerce, Americanas",corpus já disponível,"Nilc, FastText",Não descrito,Classificação (treinamento e teste de dados),Python,"Word2Vec, FastText, GloVe, word embeddings, BERT, BERTimbau, BERT multilingual (M-BERT), Nilc","similaridade de cosseno, Precisão, Revocação, F1-Score",http://www.nilc.icmc.usp.br/nilc/index.php/repositorio-de-word-embeddings-do-nilc ,STIL_2021
"BARBOSA, André; GODOY, Alan. Augmenting Customer Support with an NLP-based Receptionist. In: SIMPÓSIO BRASILEIRO DE TECNOLOGIA DA INFORMAÇÃO E DA LINGUAGEM HUMANA (STIL), 13. , 2021, Evento Online. Anais [...]. Porto Alegre: Sociedade Brasileira de Computação, 2021 . p. 133-142. DOI: https://doi.org/10.5753/stil.2021.17792",QuintoAndar chatbot,corpus construído/coletado,Não descrito,"Remoção (acentos, stopwords), lowercasing","Classificação (treinamento e teste de dados, extração de características)",Python,"Bag-of-words (BoW), Logistic Regression (LR), BERT, Random Forest (RF), multi-layer perceptron (MLP)","Precisão, Acurácia",Não descrito,STIL_2021
"CASANI, Vinicius; SOUZA, Alinne C. Correa; MANTOVANI, Rafael G.; SOUZA, Francisco Carlos M.. DP-Symptom-Identifier: uma estratégia para classificar sintomas de depressão utilizando um conjunto de dados textuais na língua portuguesa. In: SIMPÓSIO BRASILEIRO DE TECNOLOGIA DA INFORMAÇÃO E DA LINGUAGEM HUMANA (STIL), 13. , 2021, Evento Online. Anais [...]. Porto Alegre: Sociedade Brasileira de Computação, 2021 . p. 153-161. DOI: https://doi.org/10.5753/stil.2021.17794",Twitter,corpus construído/coletado,Não descrito,"Limpeza, Remoção (stopwords, pontuações, números, links, menções), stemmization, lowercasing","Classificação (rotulagem de dados, extração de características, treinamento e teste de dados, Análise de sentimentos)","Python, Java","Bag-of-words (BoW), TF-IDF, BERT, Random Forest (RF), multi-layer perceptron (MLP), Support Vector Machine (SVM), Naive Bayes (NB)","Area Under the ROC Curve (AUC), validação cruzada",https://github.com/fcarlosmonteiro/dp-symptom-identifier,STIL_2021
"MENDES, Augusto R.; PASSADOR, Rafael V. P.; CASELI, Helena M.. Identificando sintomas de depressão em postagens do Twitter em português do Brasil. In: SIMPÓSIO BRASILEIRO DE TECNOLOGIA DA INFORMAÇÃO E DA LINGUAGEM HUMANA (STIL), 13. , 2021, Evento Online. Anais [...]. Porto Alegre: Sociedade Brasileira de Computação, 2021 . p. 162-171. DOI: https://doi.org/10.5753/stil.2021.17795",Twitter,corpus já disponível,"Enelvo, LIWC, gensim, scikit-learn, nilc","normalização, redução de dimensionalidade","Classificação (rotulagem, extração de características, identificação de polaridade)",Python,"rotulação fraca, LIWC, TF-IDF, bert, BERTimbau, word embeddings, NILC, Support Vector Machine (SVM), multi-layer perceptron (MLP), Logistic Regression (LR), Principal Component Analysis (PCA)","F1-Score, validação cruzada",https://github.com/LALIC-UFSCar/Amive-PLN,STIL_2021
"MOTA, Ana Alice Ximenes; FRANCO, Wellington; MATTOS, César Lincoln Cavalcante. Detecção de desinformação sobre Covid-19 no Twitter. In: SIMPÓSIO BRASILEIRO DE TECNOLOGIA DA INFORMAÇÃO E DA LINGUAGEM HUMANA (STIL), 13. , 2021, Evento Online. Anais [...]. Porto Alegre: Sociedade Brasileira de Computação, 2021 . p. 172-181. DOI: https://doi.org/10.5753/stil.2021.17796",Twitter,corpus construído/coletado,"NLTK, Regex, scikit-learn","Remoção (stopwords, números, pontuações, links), lowercasing, tokenização","Classificação (rotulagem de dados, treinamento e teste de dados)",Python,"Bag-of-words (BoW), TF-IDF, Word2Vec, LightGBM (LGBM), Random Forest (RF), Support Vector Machine (SVM), Logistic Regression (LR), AdaBoost (AB), Naive Bayes (NB), grid search","Acurácia, Precisão, Revocação, F1-Score, Area Under the ROC Curve (AUC), validação cruzada",https://github.com/aliceximenes/fake-news-covid-19,STIL_2021
"SOUZA, Cinthia M.; VIMIEIRO, Renato. A Long Texts Summarization Approach to Scientific Articles. In: SIMPÓSIO BRASILEIRO DE TECNOLOGIA DA INFORMAÇÃO E DA LINGUAGEM HUMANA (STIL), 13. , 2021, Evento Online. Anais [...]. Porto Alegre: Sociedade Brasileira de Computação, 2021 . p. 182-189. DOI: https://doi.org/10.5753/stil.2021.17797",Plos One,corpus já disponível,hugging face,"Remoção (citações, caracteres especiais, espaços, quebra de linha, stopwords), lowercasing, stemmization","Clusterização, sumarização",Python,"SumBasic, LexRank, TextRank, BERT, TF-IDF, PageRank, K-Means (KM), SciBERT","Similaridade de cosseno, Rouge","https://github.com/CinthiaS/long_text_summarization
https://github.com/chakki-works/sumeval
https://github.com/dmmiller612/bert-extractive-summarizer
https://github.com/allenai/scibert


",STIL_2021
"MORENO-JIMÉNEZ, Luis-Gil; TORRES-MORENO, Juan-Manuel; WEDEMANN, Roseli S.. A Preliminary Study for Literary Rhyme Generation based on Neuronal Representation, Semantics and Shallow Parsing. In: SIMPÓSIO BRASILEIRO DE TECNOLOGIA DA INFORMAÇÃO E DA LINGUAGEM HUMANA (STIL), 13. , 2021, Evento Online. Anais [...]. Porto Alegre: Sociedade Brasileira de Computação, 2021 . p. 190-198. DOI: https://doi.org/10.5753/stil.2021.17798",MegaLite- Es,corpus já disponível,FreeLing,bigramas,análise sintática,Python,"Automatic Text Generation (ATG), RNN, Word2Vec, PERL 5.0, Canned Text method, Empty Grammatical Structures (PGSs), FreeLing, word embeddings, Language Model Analysis (Bigrams)",similaridade de cosseno,Não descrito,STIL_2021
"SANTOS, Roney Lira de Sales; PARDO, Thiago Alexandre Salgueiro. Structural Characterization and Graph-based Detection of Fake News in Portuguese. In: SIMPÓSIO BRASILEIRO DE TECNOLOGIA DA INFORMAÇÃO E DA LINGUAGEM HUMANA (STIL), 13. , 2021, Evento Online. Anais [...]. Porto Alegre: Sociedade Brasileira de Computação, 2021 . p. 199-208. DOI: https://doi.org/10.5753/stil.2021.17799",Fake.Br,corpus já disponível,"Nltk, NLPNet, networkx, Scikit-Learn, MLxtend","Remoção (stopwords), Tokenização","Classificação (análise de redes, treinamento e teste de dados), clusterização",Python,"SentiElection Approach (SEA), Pagerank, Random Forest (RF), multi-layer perceptron (MLP), Support Vector Machine (SVM), Naive Bayes (NB), Decision Tree Classifier (DTC), K-Nearest Neighbor (KNN), OneRule (OneR), One Class (OC), K-Means (KM)","Acurácia, Betweenness, Closeness, Eigenvector, Katz, Authorities, Cluster Coeff Avg, coeficiente de agrupamento, Correlation, Transitivity, Density, validação cruzada",https://sites.google.com/icmc.usp.br/poetisa,STIL_2021
"MONTESUMA, Eduardo F.; CARNEIRO, Lucas C.; DAMASCENO, Adson R. P.; SAMPAIO, João Victor F. T. de; FÉRRER FILHO, Romulo F.; MAIA, Paulo Henrique M.; OLIVEIRA, Francisco C. M. B.. An Empirical Study of Information Retrieval and Machine Reading Comprehension Algorithms for an Online Education Platform. In: SIMPÓSIO BRASILEIRO DE TECNOLOGIA DA INFORMAÇÃO E DA LINGUAGEM HUMANA (STIL), 13. , 2021, Evento Online. Anais [...]. Porto Alegre: Sociedade Brasileira de Computação, 2021 . p. 217-226. DOI: https://doi.org/10.5753/stil.2021.17801",Dell Accessible Learning (DAL),corpus construído/coletado,Não descrito,"Remoção (stopwords, acentos, números, pontuações), lowercasing, lemmatization, redução de dimensionalidade","recuperação de informação, incorporação de palavras, Visualização (t-SNE)",Python,"TF-IDF, Machine Reading Comprehension (MRC), Question Answering (QA), Bag-of-words (BoW), glove, word embeddings, Word Mover Distance (WMD), electra, BERT, RoBERTa, ALBERT, GLUE, Principal Component Analysis (PCA), t-SNE","Similaridade de cosseno, Acurácia, F1-Score",Não descrito,STIL_2021
"SOUZA, Ellen; MORIYAMA, Gyovana; VITÓRIO, Douglas; CARVALHO, André C. P. L. F. de; FÉLIX, Nádia; ALBUQUERQUE, Hidelberg O.; OLIVEIRA, Adriano L. I.. Assessing the Impact of stemmization Algorithms Applied to Brazilian Legislative Documents Retrieval. In: SIMPÓSIO BRASILEIRO DE TECNOLOGIA DA INFORMAÇÃO E DA LINGUAGEM HUMANA (STIL), 13. , 2021, Evento Online. Anais [...]. Porto Alegre: Sociedade Brasileira de Computação, 2021 . p. 227-236. DOI: https://doi.org/10.5753/stil.2021.17802",Câmara dos Deputados,corpus já disponível,Nltk,"Remoção (pontuações), lowercasing, stemmization, redução de dimensionalidade",recuperação de informação,Python,"NoStem, Porter, RSLP Stemmer, Savoy (UniNE), Okapi BM25, BM25L, Friedman e Nemeyi test","Revocação, reduction per document (RP), unique terms per document (UTD)",https://github.com/Convenio-Camara-dos-Deputados/BM25-Experiments,STIL_2021
"SERRAS, Felipe R.; FINGER, Marcelo. verBERT: Automating Brazilian Case Law Document Multi-label Categorization Using BERT. In: SIMPÓSIO BRASILEIRO DE TECNOLOGIA DA INFORMAÇÃO E DA LINGUAGEM HUMANA (STIL), 13. , 2021, Evento Online. Anais [...]. Porto Alegre: Sociedade Brasileira de Computação, 2021 . p. 237-246. DOI: https://doi.org/10.5753/stil.2021.17803",Kollemata Project,corpus já disponível,"hugging face, nltk, scikit-learn","Remoção (stopwords), Tokenização, stemmization, redução de dimensionalidade","categorização multi-rótulo, recuperação de informação, clusterização, classificação (treinamento e teste de dados)",Python,"BERT, GLUE, BERT multilingual (M-BERT), BERTimbau, RSLP Stemmer, K-means (KM), otimizador AdamW","Precisão, Revocação, F1-Score, Acurácia, Cross Entropy",https://github.com/frserras/verbert-categorization,STIL_2021
"MONTE-SERRAT, Dionéia Motta; MACHADO, Mateus Tarcinalli; RUIZ, Evandro Eduardo Seron. A machine learning approach to literary genre classification on Portuguese texts: circumventing NLP’s standard varieties. In: SIMPÓSIO BRASILEIRO DE TECNOLOGIA DA INFORMAÇÃO E DA LINGUAGEM HUMANA (STIL), 13. , 2021, Evento Online. Anais [...]. Porto Alegre: Sociedade Brasileira de Computação, 2021 . p. 255-264. DOI: https://doi.org/10.5753/stil.2021.17805",BDCamões,corpus já disponível,Eli5,Pos tagging,"Classificação (anotação morfossintática, Classificação de gênero literário, identificação de classes gramaticais)",Python,"Random Forest (RF), LIWC, Part-of-Speech tags (POS tags), grid search, Universal Dependencies (UD)","validação cruzada, F1-Score, Precisão, Revocação, ",Não descrito,STIL_2021
"PAULA, Robson T.; AGUIAR NETO, Décio G.; ROMERO, Davi; GUERRA, Paulo T.. Evaluation of Synthetic Datasets Generation for Intent Classification Tasks in Portuguese. In: SIMPÓSIO BRASILEIRO DE TECNOLOGIA DA INFORMAÇÃO E DA LINGUAGEM HUMANA (STIL), 13. , 2021, Evento Online. Anais [...]. Porto Alegre: Sociedade Brasileira de Computação, 2021 . p. 265-274. DOI: https://doi.org/10.5753/stil.2021.17806",Carta de Serviços do Cidadão-Ceará,corpus construído/coletado,"RASA, Hugging face",Não descrito,"Classificação (detecção de intenção, geração de sentenças, identificação de entidades, treinamento e teste de dados)",Não descrito,"BERT, BerTimbau, BERT multilingual (M-BERT), Dual In-tent and Entity Transformer (DIET)","BLEU, F1-Score, Acurácia, Revocação",https://huggingface.co/rasa/LaBSE,STIL_2021
"ESTRELLA, Arthur T.; SOUZA FILHO, João B. O.. Tackling neural machine translation in low-resource settings: a Portuguese case study. In: SIMPÓSIO BRASILEIRO DE TECNOLOGIA DA INFORMAÇÃO E DA LINGUAGEM HUMANA (STIL), 13. , 2021, Evento Online. Anais [...]. Porto Alegre: Sociedade Brasileira de Computação, 2021 . p. 275-282. DOI: https://doi.org/10.5753/stil.2021.17807","Taobeta, TED Talks",corpus já disponível,"Kaggle, sacrebleu, Nltk, Texar, PyTorch, FastText",Remoção (XML),"Classificação (treinamento e teste de dados), reduzir out-of-vocabulary (OOV), identificação de padrões de erro, multidimensional evaluation",Colab,"word embeddings, Back-Translation (BT), FastText, Neural Machine Translation (NMT), Byte Pair Encoding (BPE), CEFR scale, Multiple Fisher test, otimizador AdamW",BLEU,https://github.com/arthur-telles3/pt-nmt-low-resource,STIL_2021
"LUZ, Elian Conceição; SILVA, Camilla Rastely da; CLARO, Daniela Barreiro. Engenharia de features linguísticas para classificação de triplas relacionais. In: SIMPÓSIO BRASILEIRO DE TECNOLOGIA DA INFORMAÇÃO E DA LINGUAGEM HUMANA (STIL), 13. , 2021, Evento Online. Anais [...]. Porto Alegre: Sociedade Brasileira de Computação, 2021 . p. 381-388. DOI: https://doi.org/10.5753/stil.2021.17818",Não descrito,corpus construído/coletado,Não descrito,"tokenização, PoS tagging","Classificação (treinamento e teste de dados, análise de triplas, extração de características, identificação de classes gramaticais), Tradução, extração de informação",Não descrito,"Logistic Regression (LR), Decision Tree Classifier (DTC), K-Nearest Neighbor (KNN)","validação cruzada, Precisão, Revocação, F1-Score, Acurácia",Não descrito,STIL_2021
"WICK-PEDRO, Gabriela; SANTOS, Roney L. S.. Complexidade textual em notícias satíricas: uma análise para o português do Brasil. In: SIMPÓSIO BRASILEIRO DE TECNOLOGIA DA INFORMAÇÃO E DA LINGUAGEM HUMANA (STIL), 13. , 2021, Evento Online. Anais [...]. Porto Alegre: Sociedade Brasileira de Computação, 2021 . p. 409-415. DOI: https://doi.org/10.5753/stil.2021.17821",Sensacionalista,corpus construído/coletado,"NILC-Metrix, Nilc",Não descrito,detecção automática de notícias satíricas,Não descrito,NILC,"Flesch Readability Ease Score (FRES), Type-Token Ratio (TTR)","http://fw.nilc.icmc.usp.br:23380/nilcmetrix
http://fw.nilc.icmc.usp.br:23380/metrixdoc",STIL_2021
"MOTTA, Ester; FINATTO, Maria José Bocorny. Constituintes Frasais com Função de Sujeito em Sentenças Judiciais. In: SIMPÓSIO BRASILEIRO DE TECNOLOGIA DA INFORMAÇÃO E DA LINGUAGEM HUMANA (STIL), 13. , 2021, Evento Online. Anais [...]. Porto Alegre: Sociedade Brasileira de Computação, 2021 . p. 416-424. DOI: https://doi.org/10.5753/stil.2021.17822",Juizados Especiais Cíveis (JECs),corpus já disponível,"AntConc, Nilc, NILC-Metrix",Não descrito,"cálculo das metainformações, classificação (rotulagem de dados, identificação de classes gramaticais)",Não descrito,"Nilc, AntConc",Não descrito,Não descrito,STIL_2021
"ALEXANDRE, Dominick M.; GURGEL, Juliana L.; ARARIPE, Leonel F. de A.. Compilação de um corpus etiquetado da Língua Geral Amazônica. In: SIMPÓSIO BRASILEIRO DE TECNOLOGIA DA INFORMAÇÃO E DA LINGUAGEM HUMANA (STIL), 13. , 2021, Evento Online. Anais [...]. Porto Alegre: Sociedade Brasileira de Computação, 2021 . p. 427-431. DOI: https://doi.org/10.5753/stil.2021.17823",Língua Geral Amazônica (LGA),corpus construído/coletado,Python Dictionary,"remoção (caracteres especiais), tokenização","classificação (rotulagem de dados, identificação de classes gramaticais, anotação morfossintática, identificação de sentenças), cálculo das metainformações",Python,Part-of-Speech tags (POS tags),Não descrito,https://github.com/juliana-gurgel/yrl/tree/main/pibic-2020-2021,STIL_2021
"TANIWAKI, Sabrina de Fátima Barbosa; SOUZA, Jackson Wilke da Cruz. Criação e Anotação do corpus de resumos científicos de Ciências Sociais Aplicadas. In: SIMPÓSIO BRASILEIRO DE TECNOLOGIA DA INFORMAÇÃO E DA LINGUAGEM HUMANA (STIL), 13. , 2021, Evento Online. Anais [...]. Porto Alegre: Sociedade Brasileira de Computação, 2021 . p. 437-441. DOI: https://doi.org/10.5753/stil.2021.17825",Não descrito,corpus construído/coletado,WebAnno,Não descrito,"classificação (rotulagem de dados, identificação de classes gramaticais, anotação morfossintática), cálculo das metainformações",WebAnno,Part-of-Speech tags (POS tags),Coeficiente Kappa de Cohen,Não descrito,STIL_2021
"RODRIGUES, Rodrigo F.; FREITAS, Larissa A. de. Utilizando Pistas Linguística para Detectar Conteúdo Enganoso em Português. In: SIMPÓSIO BRASILEIRO DE TECNOLOGIA DA INFORMAÇÃO E DA LINGUAGEM HUMANA (STIL), 13. , 2021, Evento Online. Anais [...]. Porto Alegre: Sociedade Brasileira de Computação, 2021 . p. 447-451. DOI: https://doi.org/10.5753/stil.2021.17827","Twitter, Fake.br",corpus já disponível,"LC-Tool, freeoffice_pt-BR, spacy",Pos tagging,"cálculo das metainformações, classificação (análise de sentimentos, identificação de classes gramaticais), extração de pistas linguísticas",Python,"Part-of-Speech tags (POS tags), LeIA (Léxico para Inferência Adaptada), cálculo da emotividade",Não descrito,https://github.com/pseudorfrodrigues/LinguisticCluesTool,STIL_2021
"de Souza, A.R.R. et al. (2022). Mortality Risk Evaluation: A Proposal for Intensive Care Units Patients Exploring Machine Learning Methods. In: Xavier-Junior, J.C., Rios, R.A. (eds) Intelligent Systems. BRACIS 2022. Lecture Notes in Computer Science(), vol 13653. Springer, Cham. https://doi.org/10.1007/978-3-031-21686-2_1",MIMIC-III,corpus construído/coletado,Não descrito,"Remoção (outliers), normalização","Classificação (treinamento e teste de dados), Visualização (Matriz de confusão)",Não descrito,"Gradient Boosting Machine (GBM), Naive Bayes (NB), Support Vector Machine (SVM), multi-layer perceptron (MLP), Random Forest (RF), AdaBoost (AB), XGBoost, LDA, Randomized Search CV, StratifiedKFold","Pearson, Area Under the ROC Curve (AUC), Desvio Padrão, validação cruzada, F1-Score, Revocação, Especificidade",Não descrito,BRACIS_2022
"Vitório, D., Souza, E., Martins, L., da Silva, N.F.F., de Leon Ferreira de Carvalho, A.C.P., Oliveira, A.L.I. (2022). Ulysses-RFSQ: A Novel Method to Improve Legal Information Retrieval Based on Relevance Feedback. In: Xavier-Junior, J.C., Rios, R.A. (eds) Intelligent Systems. BRACIS 2022. Lecture Notes in Computer Science(), vol 13653. Springer, Cham. https://doi.org/10.1007/978-3-031-21686-2_6",Câmara dos Deputados,corpus já disponível,Savoy,"Remoção (stopwords, pontuações, acentos), stemmization, unigramas, bigramas",recuperação de informação,Não descrito,Okapi BM25,"validação cruzada, Revocação",Não descrito,BRACIS_2022
"Filho, I.J.R., Martins, L.H.D., Parmezan, A.R.S., Marcacini, R.M., Rezende, S.O. (2022). Sequential Short-Text Classification from Multiple Textual Representations with Weak Supervision. In: Xavier-Junior, J.C., Rios, R.A. (eds) Intelligent Systems. BRACIS 2022. Lecture Notes in Computer Science(), vol 13653. Springer, Cham. https://doi.org/10.1007/978-3-031-21686-2_12","Notícias Agrícolas, CEPEA",corpus construído/coletado,Não descrito,"Remoção (acentos, stopwords, pontuações, caracteres especiais), redução de dimensionalidade, unigramas, stemmization, lowercasing","Classificação (treinamento e teste de dados, rotulagem de dados)",Python,"bag-of-words (BoW), BERT, BERTimbau, BERT multilingual (M-BERT), DistilBERT, Naive Bayes (NB), Support Vector Machine (SVM), multi-layer perceptron (MLP), K-Nearest Neighbor (KNN), Binary BoW, TF, TF-IDF, Principal Component Analysis (PCA)","similaridade de cosseno, F1-Score, Precisão, Revocação, Acurácia",https://github.com/ivanfilhoreis/ws_text,BRACIS_2022
"Bittencourt, L.F., Parraga, O., Ruiz, D.D., Manssour, I.H., Musse, S.R., Barros, R.C. (2022). Leveraging Textual Descriptions for House Price Valuation. In: Xavier-Junior, J.C., Rios, R.A. (eds) Intelligent Systems. BRACIS 2022. Lecture Notes in Computer Science(), vol 13653. Springer, Cham. https://doi.org/10.1007/978-3-031-21686-2_25",Não descrito,corpus construído/coletado,"scikit-learn, NLTK, ELI5, FastText","Remoção (acentos, stopwords, pontuações, caracteres especiais), redução de dimensionalidade, lowercasing","Classificação (treinamento e teste de dados), Visualização (nuvem de palavras)",Python,"Truncated SVD, Bag-of-words (BoW), TF-IDF, word embeddings, FastText, BERT, otimizador AdamW, Gradient Boosting Machine (GBM), Naive Bayes (NB), Random Forest (RF), XGBoost, Extremely Randomized Trees (ERT), LightGBM (LGBM), Binary BoW, Automated Valuation Models (AVM)","coeficiente de determinação, Erro Absoluto Médio (MAE), Erro Percentual Médio Absoluto (MAPE), Root Mean Square Error (RMSE), MdAPE",https://github.com/Otavio-Parraga/textual-house-pricing,BRACIS_2022
"Avelar, P.H.C., Audibert, R.B., Lamb, L.C. (2022). Measuring Ethics in AI with AI: A Methodology and Dataset Construction. In: Xavier-Junior, J.C., Rios, R.A. (eds) Intelligent Systems. BRACIS 2022. Lecture Notes in Computer Science(), vol 13653. Springer, Cham. https://doi.org/10.1007/978-3-031-21686-2_26",arXiv,corpus construído/coletado,Não descrito,Não descrito,"Classificação (dados validados manualmente, rotulagem de dados, treinamento e teste de dados, balanceamento de dados)",Python,"bag-of-words (BoW), Gradient Boosting Machine (GBM), Random Forest (RF), multi-layer perceptron (MLP), Decision Tree Classifier (DTC), Logistic Regression (LR), AdaBoost (AB), smote, adasyn, TF-IDF, TF","validação cruzada, Area Under the ROC Curve (AUC), Precisão, Revocação",https://github.com/phcavelar/arxiv-ethics,BRACIS_2022
"Pelozo, M.L., Custódio, M., Panisson, A.R. (2022). Answering Questions About COVID-19 Vaccines Using ChatBot Technologies. In: Xavier-Junior, J.C., Rios, R.A. (eds) Intelligent Systems. BRACIS 2022. Lecture Notes in Computer Science(), vol 13653. Springer, Cham. https://doi.org/10.1007/978-3-031-21686-2_32",Não descrito,corpus construído/coletado,"Rasa, Spacy",Não descrito,"Classificação (treinamento e teste de dados), Visualização (matriz de confusão)",Não descrito,RASA,"Acurácia, F1-Score, Precisão",Não descrito,BRACIS_2022
