Article Source,Data Source,Data nature,Tool and Technology,Preprocessing,Tasks,Development environment,Techniques,Metrics,Repository,Event
"BARBOSA, Carlos M. G.; FÉLIX, Lucas G. da S.; ALVES, Antônio Pedro S.; XAVIER, Carolina Ribeiro; VIEIRA, Vinícius da Fonseca. Uso de URLs para caracterização de comunidades em Redes Sociais Online. In: BRAZILIAN WORKSHOP ON SOCIAL NETWORK ANALYSIS AND MINING (BRASNAM), 11. , 2022, Niterói. Anais [...]. Porto Alegre: Sociedade Brasileira de Computação, 2022 . p. 25-36. ISSN 2595-6094. DOI: https://doi.org/10.5753/brasnam.2022.223262",Twitter,corpus construído/coletado,"NLTK, Spacy","Remoção (stopwords), tokenização, bigramas","Classificação (identificação de comunidades, análise de redes), Modelagem de tópicos",Python,"Louvain, LDA, PageRank",Modularidade,https://lookerstudio.google.com/u/0/reporting/283fb3e8-6a14-4afd-99a1-b8b24d4386f7/page/D06xB?s=sTc7JJwEhpE,BraSNAM_2022
"SANTOS, Patricia D.; GOYA, Denise H.. Detecção de Posicionamento e Rotulação Automática de Usuários do Twitter: estudo sobre o embate científico-político no contexto da CPI da Covid-19. In: BRAZILIAN WORKSHOP ON SOCIAL NETWORK ANALYSIS AND MINING (BRASNAM), 11. , 2022, Niterói. Anais [...]. Porto Alegre: Sociedade Brasileira de Computação, 2022 . p. 49-60. ISSN 2595-6094. DOI: https://doi.org/10.5753/brasnam.2022.223212",Twitter,corpus construído/coletado,Não descrito,"Remoção (stopwords, links, emojis, hashtags, pontuações, espaços, linhas em branco, textos duplicados, menções, aspas), lowercasing, tokenização, redução de dimensionalidade","Clusterização, Modelagem de tópicos, Classificação (rotulagem de dados, detecção de posicionamento, Pontuação de valência, extração de características)",Python,"UMAP, Mean Shift, BERTopic, BERT, BERTimbau, HDBSCAN, TF-IDF, c-TF-IDF, word embeddings","Similaridade de cosseno, grau de engajamento, grau de equilíbrio, Intervalo de confiança",Não descrito,BraSNAM_2022
"PAES, Vinícius J.; ARAÚJO, Danilo; BRITO, Kellyton; ANDRADE, Ermeson. Análise de Sentimento em Tweets Relacionados ao Desmatamento da Floresta Amazônica. In: BRAZILIAN WORKSHOP ON SOCIAL NETWORK ANALYSIS AND MINING (BRASNAM), 11. , 2022, Niterói. Anais [...]. Porto Alegre: Sociedade Brasileira de Computação, 2022 . p. 61-72. ISSN 2595-6094. DOI: https://doi.org/10.5753/brasnam.2022.222648",Twitter,corpus construído/coletado,"Twint, TextBlob, Wordcloud, Syuzhet","Remoção (acentos, links, emojis, caracteres especiais), lowercasing","Visualização (nuvem de palavra, gráfico de emoções), Classificação (identificação de emoções, Análise de sentimentos, frequência de termos, identificação de polaridade)","Python, Jupyter Notebook, R","wordcloud, NRC sentiment, Syuzhet",Não descrito,Não descrito,BraSNAM_2022
"FEITOSA, Marcos Paulo Fontes; FERREIRA, Carlos H. G.; GONÇALVES, Glauber Dias; ALMEIDA, Jussara Marques de. Análise da Percepção das Pessoas no Twitter Sobre Ações Policiais. In: BRAZILIAN WORKSHOP ON SOCIAL NETWORK ANALYSIS AND MINING (BRASNAM), 11. , 2022, Niterói. Anais [...]. Porto Alegre: Sociedade Brasileira de Computação, 2022 . p. 73-84. ISSN 2595-6094. DOI: https://doi.org/10.5753/brasnam.2022.223267","UOL, Folha de São Paulo, G1, Twitter",corpus construído/coletado,"NLTK, Tweepy","Remoção (links, quebras de linha)","Classificação (rotulagem de dados, balanceamento de dados, treinamento e teste de dados), Visualização (Matriz de confusão)",Python,"BERT, BERTimbau, BERT multilingual (M-BERT), word embeddings, smote, Random Forest (RF), Support Vector Machine (SVM), otimizador AdamW","Fleiss Kappa, Acurácia, Precisão, Revocação, F1-Score, F1-Macro",https://github.com/LABPAAD/crimes_stance,BraSNAM_2022
"ALVES, Otávio; FALCÃO, Taciana Pontual; VALENÇA, George; ANDRADE, Ermeson. BRIMO: uma Ferramenta para Análise de Sentimentos. In: BRAZILIAN WORKSHOP ON SOCIAL NETWORK ANALYSIS AND MINING (BRASNAM), 11. , 2022, Niterói. Anais [...]. Porto Alegre: Sociedade Brasileira de Computação, 2022 . p. 97-108. ISSN 2595-6094. DOI: https://doi.org/10.5753/brasnam.2022.222842.",Twitter,Não descrito,"Angular, Flask, Pumbler, Celery, Redis, ChartJS, PrimeNG, Wordcloud, Syuzhet","Remoção (stopwords, caracteres especiais, pontuações), lowercasing, stemmization, lemmatization","Classificação (Identificação de emoções, Análise de sentimentos, identificação de polaridade), Visualização (wordcloud), teste de usabilidade","Python, R, Heroku","wordcloud, NRC sentiment, Syuzhet",Escala SUS (System Usuability Scale),https://brimo-front.herokuapp.com/,BraSNAM_2022
"SANTOS, Vinícius S. dos; HENRIQUES, Felipe da R.; GUEDES, Gustavo. O Discurso de Ódio Homofóbico no Twitter a partir da Análise de Dados. In: BRAZILIAN WORKSHOP ON SOCIAL NETWORK ANALYSIS AND MINING (BRASNAM), 11. , 2022, Niterói. Anais [...]. Porto Alegre: Sociedade Brasileira de Computação, 2022 . p. 109-120. ISSN 2595-6094. DOI: https://doi.org/10.5753/brasnam.2022.222916.",Twitter,corpus construído/coletado,"NLTK, Hatebase","Remoção (stopwords, links, emojis, imagens e outros), stemmization, lowercasing, bigramas","Clusterização, Visualização (wordcloud), Classificação (análise de léxico)",Python,"TF-IDF, wordcloud, Bag-of-words (BoW)","Similaridade de cosseno, Método elbow (cotovelo)",Não descrito,BraSNAM_2022
"LAURETT, Natan S.; RIBEIRO, Filipe N.. Caracterização das publicações e relações entre mídias alternativas polarizadas no Facebook. In: BRAZILIAN WORKSHOP ON SOCIAL NETWORK ANALYSIS AND MINING (BRASNAM), 11. , 2022, Niterói. Anais [...]. Porto Alegre: Sociedade Brasileira de Computação, 2022 . p. 133-144. ISSN 2595-6094. DOI: https://doi.org/10.5753/brasnam.2022.223250",Facebook,corpus construído/coletado,Crewdtangle,Não descrito,"Classificação (Formação de Grafos, extração de backbone, identificação de comunidades, análise de engajamento, Filtragem de domínios), Visualização (boxplot), clusterização",Crowdtangle,"Método de Filtro de disparidade, Louvain","Coeficiente de similaridade de Jaccard, Modularidade, distribuição cumulativa, grau médio, peso médio, densidade",Não descrito,BraSNAM_2022
"ALVES, Antônio P. S.; FÉLIX, Lucas G. da Silva; BARBOSA, Carlos M. G.; VIEIRA, Vinícius da Fonseca; XAVIER, Carolina Ribeiro. Tiradentes no TripAdvisor - O que se fala sobre essa simpática cidade histórica?. In: BRAZILIAN WORKSHOP ON SOCIAL NETWORK ANALYSIS AND MINING (BRASNAM), 11. , 2022, Niterói. Anais [...]. Porto Alegre: Sociedade Brasileira de Computação, 2022 . p. 145-156. ISSN 2595-6094. DOI: https://doi.org/10.5753/brasnam.2022.223293",TripAdvisor,corpus construído/coletado,"Selenium, BeautifulSoup","Remoção (stopwords, entidades desnecessárias), Junção de nomes próprios, PoS tagging","Modelagem de tópicos, clusterização, Classificação (Análise de sentimentos, identificação de polaridade, identificação de classes gramaticais), Visualização (wordcloud)",Python,"NMF, TF-IDF, LeIA (Léxico para Inferência Adaptada), VADER, wordcloud, Named Entity Recognition (NER)","NPMI, Root Mean Square Error (RMSE)",Não descrito,BraSNAM_2022
"COSTA, Geandreson de S.; COUTO, Danielle C. C.; JACOB JUNIOR, Antonio F. L.; LOBATO, Fábio M. F.. Feminismo e Redes Sociais Online: uma Análise de Tweets sobre o Dia Internacional da Mulher. In: BRAZILIAN WORKSHOP ON SOCIAL NETWORK ANALYSIS AND MINING (BRASNAM), 11. , 2022, Niterói. Anais [...]. Porto Alegre: Sociedade Brasileira de Computação, 2022 . p. 169-180. ISSN 2595-6094. DOI: https://doi.org/10.5753/brasnam.2022.223334",Twitter,corpus construído/coletado,"MongoDB, Pandas, iFeel, os_module","Remoção (stopwords, links, menções, hashtags, pontuações, quebras de linha, caracteres especiais, acentuações)","Modelagem de tópicos, Classificação (Análise de sentimentos, identificação de polaridade, rotulagem de dados)",Python,"TF-IDF, NMF, Metodologia Delphi, iFeel",Não descrito,https://github.com/fabiolobato/8m_brasnam2022,BraSNAM_2022
"CÂMARA, Vanessa de Souza; MELO, Tiago de. Estudo de Método de Extração de Aspectos para Português do Brasil Baseado em Regras. In: BRAZILIAN WORKSHOP ON SOCIAL NETWORK ANALYSIS AND MINING (BRASNAM), 11. , 2022, Niterói. Anais [...]. Porto Alegre: Sociedade Brasileira de Computação, 2022 . p. 192-203. ISSN 2595-6094. DOI: https://doi.org/10.5753/brasnam.2022.222609","TripAdvisor, Skoob.com",corpus construído/coletado,Spacy,Não descrito,"Classificação (rotulagem de dados, identificação de classes gramaticais, análise de sentimentos, identificação de sentenças, extração de aspectos), Visualização (Diagrama de Venn)",Python,"SenticNet, Algoritmo guloso, Algoritmo de seleção de regras ótimas","Precisão, Revocação, F1-Score","https://github.com/k4t0mono/AspectExtraction

",BraSNAM_2022
"OLIVEIRA, Gabriel P.; PAIVA, Beatriz F.; SILVA, Ana Paula Couto da; MORO, Mirella M.. Characterizing the Diffusion of Misinformation Regarding the CoronaVac Vaccine in Brazil. In: BRAZILIAN WORKSHOP ON SOCIAL NETWORK ANALYSIS AND MINING (BRASNAM), 11. , 2022, Niterói. Anais [...]. Porto Alegre: Sociedade Brasileira de Computação, 2022 . p. 204-215. ISSN 2595-6094. DOI: https://doi.org/10.5753/brasnam.2022.223173",Twitter,corpus construído/coletado,"Gensim, networkx, Gephi","Remoção (stopwords, hashtags)","Classificação (rotulagem de dados, Identificação de comunidades, caracterização topológica, caracterização de redes), Visualização (Boxplot, wordcloud), Modelagem de tópicos","Pyhton, zenodo","LDA, Louvain, PageRank, wordcloud","Coeficiente Kappa de Cohen, In-degree, out-degree, betweenness",Não descrito,BraSNAM_2022
"VITÓRIO, Douglas; ALBUQUERQUE, Hidelberg O.; SOUZA, Ellen; OLIVEIRA, Adriano L. I.; BARROS, Flávia; PRUDÊNCIO, Ricardo B. C.. Análise do posicionamento dos usuários do Twitter acerca da Vacinação Infantil contra a COVID-19 no Brasil. In: BRAZILIAN WORKSHOP ON SOCIAL NETWORK ANALYSIS AND MINING (BRASNAM), 11. , 2022, Niterói. Anais [...]. Porto Alegre: Sociedade Brasileira de Computação, 2022 . p. 222-227. ISSN 2595-6094. DOI: https://doi.org/10.5753/brasnam.2022.222817",Twitter,corpus construído/coletado,"NLTK, Scikit-learn, Tweepy","Remoção (stopwords), unigramas, bigramas","Classificação (rotulagem de dados, análise de sentimentos, treinamento e teste de dados), Visualização (wordcloud)",Python,"TF-IDF, wordcloud, Naive Bayes (NB), Support Vector Machine (SVM), Random Forest (RF), Vector Space Model (VSM)","Acurácia, F1-Score, validação cruzada",Não descrito,BraSNAM_2022
"MARINHO, Jeziel C.; CORDEIRO, Fábio; ANCHIÊTA, Rafael T.; MOURA, Raimundo S.. Automated Essay Scoring: An approach based on ENEM competencies. In: ENCONTRO NACIONAL DE INTELIGÊNCIA ARTIFICIAL E COMPUTACIONAL (ENIAC), 19. , 2022, Campinas/SP. Anais [...]. Porto Alegre: Sociedade Brasileira de Computação, 2022 . p. 49-60. ISSN 2763-9061. DOI: https://doi.org/10.5753/eniac.2022.227202",Essay-Br,corpus já disponível,"NLTK, Spacy, PyHunSpell, Hunspell, UNitex-PB, CoGrOO4py, CoGrOO","Remoção (stopwords, números, pontuações, entidades desnecessárias), lowercasing, tokenização, correção de textos, hapax legonemas","Classificação (Extração de características, extração de aspectos), Análise de classes gramaticais, Visualização (matriz de confusão)",Python,"LSA, word embeddings, Doc2Vec, Word2Vec, RNN, GBTD, Ridge, Named Entity Recognition (NER), Stanza, LSTM","Similaridade de cosseno, Kappa Quadrático Ponderado (QWK)","https://github.com/blatinier/pyhunspell
https://github.com/gpassero/cogroo4py


",ENIAC_2022
"BRITTO, Larissa F. S.; PESSOA, Luis A. S.; AGOSTINHO, Silvania C. C.. Cross-Domain Sentiment Analysis in Portuguese using BERT. In: ENCONTRO NACIONAL DE INTELIGÊNCIA ARTIFICIAL E COMPUTACIONAL (ENIAC), 19. , 2022, Campinas/SP. Anais [...]. Porto Alegre: Sociedade Brasileira de Computação, 2022 . p. 61-72. ISSN 2763-9061. DOI: https://doi.org/10.5753/eniac.2022.227217",Buscapé,corpus construído/coletado,"Scikit-Learn, Optuna, Hugging Face","Remoção (stopwords, textos duplicados, números, pontuações, símbolos)","Classificação (rotulagem de dados, análise de sentimentos, cruzamento de domínios, extração de características, identificação de polaridade, treinamento e teste de dados), Visualização (wordcloud, matriz de confusão)",Python,"Word embeddings, GloVe, TF-IDF, BERT, BERTimbau, Random Forest (RF), Support Vector Machine (SVM), Naive Bayes (NB), Logistic Regression (LR), wordcloud","Acurácia, Precisão, Revocação, F1-Score",Não descrito,ENIAC_2022
"TRINDADE, Rodrigo Neves; MARTINS, Luiz H. D.; CORREA, Geraldo Nunes; REIS FILHO, Ivan José dos. Using a labeling function for automatic classification of agribusiness news: A weak supervisory approach. In: ENCONTRO NACIONAL DE INTELIGÊNCIA ARTIFICIAL E COMPUTACIONAL (ENIAC), 19. , 2022, Campinas/SP. Anais [...]. Porto Alegre: Sociedade Brasileira de Computação, 2022 . p. 73-82. ISSN 2763-9061. DOI: https://doi.org/10.5753/eniac.2022.227219","Notícias Agrícolas, Macrotrends, CEPEA",corpus construído/coletado,"Scikit-Learn, Hugging Face","Remoção (stopwords), normalização","Classificação (rotulagem de dados, Anotação de polaridade, identificação de polaridade, treinamento e teste de dados)",Python,"Bag-of-words (BoW), TF-IDF, TF, BERT, DistilBERT, BERTimbau, K-Nearest Neighbor (KNN), multi-layer perceptron (MLP), Naive Bayes (NB), Support Vector Machine (SVM), Decision Tree Classifier (DTC), Friedman e Nemeyi test","Precisão, Revocação, F1-Score",Não descrito,ENIAC_2022
"SYM, Yan V.; CAMPOS, João Gabriel M.; JOSÉ, Marcos M.; COZMAN, Fabio G.. Comparing Computational Architectures for Automated Journalism. In: ENCONTRO NACIONAL DE INTELIGÊNCIA ARTIFICIAL E COMPUTACIONAL (ENIAC), 19. , 2022, Campinas/SP. Anais [...]. Porto Alegre: Sociedade Brasileira de Computação, 2022 . p. 377-388. ISSN 2763-9061. DOI: https://doi.org/10.5753/eniac.2022.227426",Twitter,corpus construído/coletado,MongoDB,Não descrito,"Classificação (Rotulagem, avaliação automática), Refering Expression Generation (REG)",Google Colab,"RNN, Bart, T5, Blenderbot, GPT2, template-based, pipeline-based, end-to-end, Sentence Aggregation","Bleu, Gleu, Rouge, Meteor",https://github.com/C4AI/blab-reporter,ENIAC_2022
"PINHEIRO, Pedro; SIQUEIRA, Luan; AMARIS, Marcos. A Four-Step Cascade Methodology to Classify MCN Codes Using NLP Techniques. In: ENCONTRO NACIONAL DE INTELIGÊNCIA ARTIFICIAL E COMPUTACIONAL (ENIAC), 19. , 2022, Campinas/SP. Anais [...]. Porto Alegre: Sociedade Brasileira de Computação, 2022 . p. 389-400. ISSN 2763-9061. DOI: https://doi.org/10.5753/eniac.2022.227652",Electronic Invoices (NF-e),corpus já disponível,"DBMS, PostgreSQL","Remoção (stopwords), tokenização, stemmization","Classificação (Extração de tokens, balanceamento de dados, treinamento e teste de dados), Visualização (boxplot)",Não descrito,"TF, TF-IDF, Support Vector Machine (SVM), Naive Bayes (NB), undersampling e oversampling",F1-Score,Não descrito,ENIAC_2022
"GOMES, Isabella Maria Alonso; ROMAN, Norton Trevisan. How aspects of similar datasets can impact distributional models. In: ENCONTRO NACIONAL DE INTELIGÊNCIA ARTIFICIAL E COMPUTACIONAL (ENIAC), 19. , 2022, Campinas/SP. Anais [...]. Porto Alegre: Sociedade Brasileira de Computação, 2022 . p. 579-590. ISSN 2763-9061. DOI: https://doi.org/10.5753/eniac.2022.227085","ASSIN, ASSIN2",corpus já disponível,"Pandas, numpy, Pytorch, scikit-learn, tqdm, Hugging Face",Tokenização,Classificação (treinamento e teste de dados),"Google Colab, Python","LDA, BERT, BERTimbau, Teste de Tukey, Analysis of variance (ANOVA), fine tuning, otimizador AdamW","Similaridade de cosseno, acurácia, validação cruzada","https://github.com/erickrf/Google News
https://github.com/neuralmind-ai/portuguese-bert
https://huggingface.co/neuralmind/bert-base-portuguese-cased
",ENIAC_2022
"NANCLAREZ, Rubem G.; ROMAN, Norton T.; SILVA, Fernando J. V. da. Generalizing over data sets: a preliminary study with BERT for Natural Language Inference. In: ENCONTRO NACIONAL DE INTELIGÊNCIA ARTIFICIAL E COMPUTACIONAL (ENIAC), 19. , 2022, Campinas/SP. Anais [...]. Porto Alegre: Sociedade Brasileira de Computação, 2022 . p. 602-611. ISSN 2763-9061. DOI: https://doi.org/10.5753/eniac.2022.227593","SNLI, COLIEE",corpus já disponível,Pytorch,Não descrito,Classificação (treinamento e teste de dados),Google Colab,"Inferência de Linguagem Natural (NLI), BERT, Analysis of variance (ANOVA), Teste de Tukey","Acurácia, validação cruzada",Não descrito,ENIAC_2022
"PINHEIRO, Victor Landim Teixeirense; FALEIROS, Thiago de Paulo. Aplicação de Modelos de Tópicos em análises automatizadas de discursos de senadores brasileiros. In: ENCONTRO NACIONAL DE INTELIGÊNCIA ARTIFICIAL E COMPUTACIONAL (ENIAC), 19. , 2022, Campinas/SP. Anais [...]. Porto Alegre: Sociedade Brasileira de Computação, 2022 . p. 612-623. ISSN 2763-9061. DOI: https://doi.org/10.5753/eniac.2022.227634",Senado Federal,corpus construído/coletado,"Spacy, NLTK, Gensim, MALLET","Remoção (stopwords, números, acentos, caracteres especiais, quebras de linha), lowercasing, concatenação, stemmization","Classificação (Filtragem de dados, filtragem de extremos), Modelagem de tópicos",Python,LDA,NPMI,https://github.com/VictorLandim/brazilian-senators-speeches,ENIAC_2022
"CORDEIRO, Fábio; RABELO, Ricardo de Andrade Lira; MOURA, Raimundo Santos. Classification of Irregularity Communications in Public Ombudsmen Using Supervised Learning Algorithms. In: ENCONTRO NACIONAL DE INTELIGÊNCIA ARTIFICIAL E COMPUTACIONAL (ENIAC), 19. , 2022, Campinas/SP. Anais [...]. Porto Alegre: Sociedade Brasileira de Computação, 2022 . p. 704-715. ISSN 2763-9061. DOI: https://doi.org/10.5753/eniac.2022.227178",Ouvidoria,corpus construído/coletado,"NLPAUG, scikit-learn, Pytorch, Hugging Face, nilc","Remoção (stopwords), limpeza dos dados, tokenização","Classificação (rotulagem de dados, redimensionamento, treinamento e teste de dados), Visualização (matriz de confusão)","Google Colab, Python","BERT, BERTimbau, word embeddings, Doc2Vec, Word2Vec, Bag-of-words (BoW), TF-IDF, TF, K-Nearest Neighbor (KNN), Random Forest (RF), Support Vector Machine (SVM), Naive Bayes (NB), Logistic Regression (LR), Decision Tree Classifier (DTC), Undersampling e Oversampling, Train-Valid-Test Split, otimizador AdamW","Acurácia, Precisão, Revocação, F1-Score","https://huggingface.co/neuralmind/bert-base-portuguese-cased
https://stackoverflow.com/questions/70911657/data-subset-in-python",ENIAC_2022
"LINS, Renata F.; BARROS, Flávia A.; PRUDÊNCIO, Ricardo B. C.; MELO, Wallace N.. Automatic Classification of Bug Reports for Mobile Devices: An Industrial Case Study. In: ENCONTRO NACIONAL DE INTELIGÊNCIA ARTIFICIAL E COMPUTACIONAL (ENIAC), 19. , 2022, Campinas/SP. Anais [...]. Porto Alegre: Sociedade Brasileira de Computação, 2022 . p. 728-739. ISSN 2763-9061. DOI: https://doi.org/10.5753/eniac.2022.227555",Jira (Atlassian Pty Ltd),corpus já disponível,"NLTK, RegEX, WordNetLemmatizer, Krovetz stemmization, scikit-learn, Flask","Remoção (Stopwords, símbolos, pontuações, números, ASCII), tokenização, lowercasing, lemmatization, stemmization","Classificação (treinamento e teste de dados, balanceamento de dados)",Python,"Bag-of-words (BoW), TF-IDF, word embeddings, Word2Vec, SMOTE, K-Nearest Neighbor (KNN), Random Forest (RF), Support Vector Machine (SVM), Naive Bayes (NB), Logistic Regression (LR), Decision Tree Classifier (DTC), Mann-Whitney U Test, Friedman e Nemeyi test","Area Under the ROC Curve (AUC), validação cruzada",github.com/mmihaltz/word2vec-GoogleNews-vectors,ENIAC_2022
"NUNES, Ana Luiza; RADEMAKER, Alexandre; ALENCAR, Leonel Figueiredo de. Utilizando um dicionário morfológico para expandir a cobertura lexical de uma gramática do português no formalismo HPSG. In: SIMPÓSIO BRASILEIRO DE TECNOLOGIA DA INFORMAÇÃO E DA LINGUAGEM HUMANA (STIL), 13. , 2021, Evento Online. Anais [...]. Porto Alegre: Sociedade Brasileira de Computação, 2021 . p. 11-18. DOI: https://doi.org/10.5753/stil.2021.17779","MorphoBr, PorGram",corpus já disponível,PyDelphin,Não descrito,"Classificação (formas verbais em regulares ou irregulares), Análise morfológica",Haskell,"Head-driven phrase structure grammar (HPSG), English Resource Grammar (ERG)",Não descrito,https://github.com/delph-in/pydelphin,STIL_2021
"SOUZA, Elvis de; SILVEIRA, Aline; CAVALCANTI, Tatiana; CASTRO, Maria Clara; FREITAS, Cláudia. PetroGold – Corpus padrão ouro para o domínio do petróleo. In: SIMPÓSIO BRASILEIRO DE TECNOLOGIA DA INFORMAÇÃO E DA LINGUAGEM HUMANA (STIL), 13. , 2021, Evento Online. Anais [...]. Porto Alegre: Sociedade Brasileira de Computação, 2021 . p. 29-38. DOI: https://doi.org/10.5753/stil.2021.17781",Petrolês,corpus construído/coletado,Bosque-UD,Não descrito,"Classificação (anotação morfossintática, segmentação de frases e palavras, treinamento e teste de dados), Visualização (matriz de confusão)",Python,"Método Inter-Annotator Disagreement (IAD), nmod (modificador nominal do tipo adjunto adnominal), Stanza, UDPipe, Universal Dependencies (UD)","Coeficiente Kappa de Cohen, UPOS, UAS, LAS, CLAS","https://github.com/alvelvis/conllu-merge-resolver
https://github.com/UniversalDependencies/docs/issues/757

",STIL_2021
"ASSIS, Karhyne S. Padilha de; SILVA, Camila das Merces; LEITE, Janaína da Silva; NOGUEIRA, Wellington Araujo; NOSE FILHO, Kenji; TAKAHATA, André K.; STEINBERGER-ELIAS, Margarethe. Lexicalidade biomédica e sua mensuração em um corpus sobre COVID-19 em língua portuguesa. In: SIMPÓSIO BRASILEIRO DE TECNOLOGIA DA INFORMAÇÃO E DA LINGUAGEM HUMANA (STIL), 13. , 2021, Evento Online. Anais [...]. Porto Alegre: Sociedade Brasileira de Computação, 2021 . p. 39-46. DOI: https://doi.org/10.5753/stil.2021.17782",Pubmed,corpus construído/coletado,CoGrOO,"limpeza dos dados, tokenização, stemmization, PoS tagging","Classificação (Anotação morfossintática, identificação de classes gramaticais), Visualização (boxplot)",Não descrito,"Vocabulário Teórico (VT), RSLP Stemmer, lexicalidade biomédica (Lex-BioMed)","DeL, DiL",Não descrito,STIL_2021
"CAPELLARO, Leonardo; CASELI, Helena de Medeiros. Análise de polaridade e de tópicos em tweets no domínio da política no Brasil. In: SIMPÓSIO BRASILEIRO DE TECNOLOGIA DA INFORMAÇÃO E DA LINGUAGEM HUMANA (STIL), 13. , 2021, Evento Online. Anais [...]. Porto Alegre: Sociedade Brasileira de Computação, 2021 . p. 47-55. DOI: https://doi.org/10.5753/stil.2021.17783",Twitter,corpus já disponível,"Enelvo, linear kernel, scikit-learn","Remoção (stopwords, links, emojis, retweets,hashtags, pontuações), lowercasing, normalização","Classificação (análise de sentimentos, identificação de polaridade, treinamento e teste de dados), Modelagem de tópicos, Clusterização",Python,"BERT, BERTimbau, BERTopic, HDBSCAN, TF-IDF, c-tf-idf, Support Vector Machine (SVM), Naive Bayes (NB), otimizador AdamW, fine tuning",F1-Score,Não descrito,STIL_2021
"HAMMES, Luiz Otávio Alves; FREITAS, Larissa Astrogildo de. Utilizando BERTimbau para a Classificação de Emoções em Português. In: SIMPÓSIO BRASILEIRO DE TECNOLOGIA DA INFORMAÇÃO E DA LINGUAGEM HUMANA (STIL), 13. , 2021, Evento Online. Anais [...]. Porto Alegre: Sociedade Brasileira de Computação, 2021 . p. 56-63. DOI: https://doi.org/10.5753/stil.2021.17784",GoEmotions (Reddit),corpus já disponível,"itranslate, google translate",Não descrito,"Classificação (identificação de emoções, balanceamento de dados)",Python,"BERT, BERTimbau, Class Balanced Loss (CB), fine tuning, otimizador AdamW","Precisão, revocação, F1-Score, Cross Entropy, sigmoid",https://github.com/Luzo0/GoEmotions_portuguese,STIL_2021
"GUMIEL, Yohan Bonescki; LEE, Isabela; SOARES, Tayane Arantes; FERREIRA, Thiago Castro; PAGANO, Adriana. Sentiment Analysis in Portuguese Texts from Online Health Community Forums: Data, Model and Evaluation. In: SIMPÓSIO BRASILEIRO DE TECNOLOGIA DA INFORMAÇÃO E DA LINGUAGEM HUMANA (STIL), 13. , 2021, Evento Online. Anais [...]. Porto Alegre: Sociedade Brasileira de Computação, 2021 . p. 64-72. DOI: https://doi.org/10.5753/stil.2021.17785",Diabetes Mellitus,corpus construído/coletado,Label Studio,Remoção (emojis),"Classificação (Anotação de polaridade, análise de sentimentos, treinamento e teste de dados), Visualização (matriz de confusão)",Python,"BERT, BERTimbau, BERT multilingual (M-BERT), Random Forest (RF), Support Vector Machine (SVM), Logistic Regression (LR), Decision Tree Classifier (DTC), BioBERTpt, TF-IDF","Precisão, Revocação, F1-Score, Coeficiente Kappa de Cohen",Não descrito,STIL_2021
"CORTIZ, Diogo et al. A Weakly Supervised Dataset of Fine-Grained Emotions in Portuguese. In: SIMPÓSIO BRASILEIRO DE TECNOLOGIA DA INFORMAÇÃO E DA LINGUAGEM HUMANA (STIL), 13. , 2021, Evento Online. Anais [...]. Porto Alegre: Sociedade Brasileira de Computação, 2021 . p. 73-81. DOI: https://doi.org/10.5753/stil.2021.17786",Twitter,corpus construído/coletado,Hugging Face,Remoção (hashtags),"Classificação (rotulagem de dados, Análise de sentimentos, identificação de emoções, mascaramento de dados, treinamento e teste de dados)",Python,"BERT, BERTimbau","Precisão, Revocação, F1-Score",https://github.com/diogocortiz/PortugueseEmotionRecognitionWeakSupervision,STIL_2021
