Article Source,Data Source,Data nature,Tool and Technology,Preprocessing,Tasks,Development environment,Techniques,Metrics,Repository,Event
"Fontanari, T., Fróes, T.C., Recamonde-Mendoza, M. (2022). Cross-validation Strategies for Balanced and Imbalanced Datasets. In: Xavier-Junior, J.C., Rios, R.A. (eds) Intelligent Systems. BRACIS 2022. Lecture Notes in Computer Science(), vol 13653. Springer, Cham. https://doi.org/10.1007/978-3-031-21686-2_43",PMLB,corpus já disponível,scikit-learn,Não descrito,"clusterização, classificação (balanceamento de dados, treinamento e teste de dados)",Python,"K-Means (KM), CBDSCV, DOBSCV, DBSCV, StratifiedKFold, Logistic Regression (LR), Decision Tree Classifier (DTC), Support Vector Machines (SVC), Random Forest (RF), RBF kernel","validação cruzada, acurácia, F1-Score",https://github.com/froestiago/K-Fold-Partitioning-Methods/tree/bracis22,BRACIS_2022
"LOBATO, Fábio M. F.; SOUSA, Gleyce C. de; JACOB JR., Antonio F. L.. BraSNAM em perspectiva: uma análise da sua trajetória até os 10 anos de existência. In: BRAZILIAN WORKSHOP ON SOCIAL NETWORK ANALYSIS AND MINING (BRASNAM), 10. , 2021, Evento Online. Anais [...]. Porto Alegre: Sociedade Brasileira de Computação, 2021 . p. 217-228. ISSN 2595-6094. DOI: https://doi.org/10.5753/brasnam.2021.16143","SBC OpenLib (SOL), Google Scholar, IBGE, facebook, twitter",corpus construído/coletado,"BeautifulSoup, scholarly, Cytoscape, Gephi","Remoção (caracteres especiais, espaços, quebras de linha), lowercasing","classificação (identificação de comunidades, rotulagem de dados)",Python,"Cytoscape, Gephi","Levenshtein, similaridade, coeficiente de agrupamento",https://github.com/fabiolobato/brasnam_2021,BraSNAM_2021
"PEREIRA, Fabíola S. F.. Caracterização da Propagação de Rumores no Twitter utilizando Redes Textuais Temporais. In: BRAZILIAN WORKSHOP ON SOCIAL NETWORK ANALYSIS AND MINING (BRASNAM), 10. , 2021, Evento Online. Anais [...]. Porto Alegre: Sociedade Brasileira de Computação, 2021 . p. 25-31. ISSN 2595-6094. DOI: https://doi.org/10.5753/brasnam.2021.16122",Twitter,corpus já disponível,não descrito,não descrito,modelagem da propagação de rumores,não descrito,RNN,"disseminação, persistência, Cross Entropy",Não descrito,BraSNAM_2021
"RODRIGUES, Lucas D. F.; L. JUNIOR, Luiz C. C.; JACOB JUNIOR, Antonio F. L.; LOBATO, Fábio M. F.. Desenvolvimento de um conjunto de dados com comentários extraídos da plataforma Twitch sobre o jogo League of Legends. In: BRAZILIAN WORKSHOP ON SOCIAL NETWORK ANALYSIS AND MINING (BRASNAM), 10. , 2021, Evento Online. Anais [...]. Porto Alegre: Sociedade Brasileira de Computação, 2021 . p. 91-102. ISSN 2595-6094. DOI: https://doi.org/10.5753/brasnam.2021.16128",Twitch,corpus construído/coletado,"Twitch-Python, Zenodo, NLTK, Scikit-Learn, PyTorch",Não descrito,"modelagem de tópicos, Visualização (wordcloud), classificação (detecção de discurso de ódio)",Python,"NMF, Bag-of-Words (BoW), TF-IDF, wordcloud, CNN, RNN, LSTM",Não descrito,"https://www.kaggle.com/deekshithaerlapally/hate-speech-detection-1d-cnn-glove-embedding
https://www.kaggle.com/nayansakhiya/hate-speech-detection-rnn
https://www.kaggle.com/nadergo/classifying-hate-speech-with-a-pytorch-transformer",BraSNAM_2021
"SILVA, Mariana O.; SCOFIELD, Clarisse; OLIVEIRA, Gabriel P.; SEUFITELLI, Danilo B.; MORO, Mirella M.. Exploring Brazilian Cultural Identity Through Reading Preferences. In: BRAZILIAN WORKSHOP ON SOCIAL NETWORK ANALYSIS AND MINING (BRASNAM), 10. , 2021, Evento Online. Anais [...]. Porto Alegre: Sociedade Brasileira de Computação, 2021 . p. 115-126. ISSN 2595-6094. DOI: https://doi.org/10.5753/brasnam.2021.16130",Goodreads,corpus construído/coletado,"goodreads, disparityfilter",não descrito,"Classificação (rotulagem de dados, extração de backbone, identificação de comunidades)","Python, R","Louvain, Multipartite Network Modeling, Quadratic Assignment Procedure (QAP), Cross-state Cultural Analysis","similaridade de cosseno, Coeficiente Kappa de Cohen",Não descrito,BraSNAM_2021
"SANTOS, Jéssica S.; BERNARDINI, Flávia; PAES, Aline. Measuring the Degree of Divergence when Labeling Tweets in the Electoral Scenario. In: BRAZILIAN WORKSHOP ON SOCIAL NETWORK ANALYSIS AND MINING (BRASNAM), 10. , 2021, Evento Online. Anais [...]. Porto Alegre: Sociedade Brasileira de Computação, 2021 . p. 127-138. ISSN 2595-6094. DOI: https://doi.org/10.5753/brasnam.2021.16131",Twitter,corpus construído/coletado,"Microsoft Azure, tweepy",não descrito,"Classificação (análise de sentimentos, rotulagem de dados, identificação de polaridade, rotulagem de dados, anotação de polaridade), Visualização (Diagrama de Venn, matriz de confusão)",não descrito,"Part-of-Speech tags (POS tags), crowdsourcing, Microsoft Azure","Alfa de Krippendorff, cross entropy",não descrito,BraSNAM_2021
"SOUSA, João Pedro da Silva; NASCIMENTO, Rodrigo Costa Uchoa do; ARAUJO, Renata Mendes de; COELHO, Orlando Bisacchi. Não se perca no debate! Mineração de Argumentação em Redes Sociais. In: BRAZILIAN WORKSHOP ON SOCIAL NETWORK ANALYSIS AND MINING (BRASNAM), 10. , 2021, Evento Online. Anais [...]. Porto Alegre: Sociedade Brasileira de Computação, 2021 . p. 139-150. ISSN 2595-6094. DOI: https://doi.org/10.5753/brasnam.2021.16132","IAC, imdb, reddit",corpus construído/coletado,"PRAW, NLTK, Scikit-learn","remoção (links, caracteres especiais, espaços)","Classificação (identificação de sentenças, identificação de polaridade, análise de sentimentos, treinamento e teste de dados, balanceamento de dados), Visualização (matriz de confusão)",python,"otimizador SGD, Support Vector Machine (SVM)",Não descrito,https://github.com/ciberdem/MineracaoDiscussoesRedesSociais,BraSNAM_2021
"TESTONI, Gustavo A.; SOUZA, Marcelo P.; FREIRE, Paulo Márcio S.; GOLDSCHIMIDT, Ronaldo R.. Um Método Linguístico que combina Polaridade, Emoção e Aspectos Gramaticais para Detecção de Fake News em Inglês. In: BRAZILIAN WORKSHOP ON SOCIAL NETWORK ANALYSIS AND MINING (BRASNAM), 10. , 2021, Evento Online. Anais [...]. Porto Alegre: Sociedade Brasileira de Computação, 2021 . p. 151-162. ISSN 2595-6094. DOI: https://doi.org/10.5753/brasnam.2021.16133",FakeNewsNet,corpus já disponível,"KNIME, mySQL, spacy","tokenização, Pos tagging","Classificação (identificação de emoções, identificação de polaridade, identificação de classes gramaticais, balanceamento de dados, treinamento e teste de dados),",Python,"KNIME, Part-of-Speech tags (POS tags), LIWC, Gradient Boosting Machine (GBM), AdaBoost (AB), Naive Bayes (NB), Support Vector Machine (SVM), K-Nearest Neighbor (KNN)","acurácia, validação cruzada, precisão, revocação",não descrito,BraSNAM_2021
"CARDOZO, Laerte dos Santos; FREITAS, Larissa Astrogildo de. Análise de Sentimentos: Avaliando o Desempenho de Pré-Processamento e de Algoritmos de Aprendizagem de Máquina sobre o Dataset TweetSentBR. In: BRAZILIAN WORKSHOP ON SOCIAL NETWORK ANALYSIS AND MINING (BRASNAM), 10. , 2021, Evento Online. Anais [...]. Porto Alegre: Sociedade Brasileira de Computação, 2021 . p. 169-174. ISSN 2595-6094. DOI: https://doi.org/10.5753/brasnam.2021.16135",Twitter,corpus já disponível,"SymSpellpy, NLTK, Spacy","Remoção (stopwords, acentos, pontuações, espaços), stemmization, correção de textos, lowercasing","Classificação (treinamento e teste de dados, análise de sentimentos, classificação de sentimentos, identificação de polaridade)",Python,"RSLP Stemmer, Snowball, Support Vector Machine (SVM), Support Vector Machines (SVC), TF-IDF, LSTM","validação cruzada, F1-Score",https://github.com/laertecardozo/Analise-de-Sentimentos-Portugues,BraSNAM_2021
"MELO, Tiago de. Análise Exploratória das Dúvidas sobre a COVID-19 Publicadas no Twitter. In: BRAZILIAN WORKSHOP ON SOCIAL NETWORK ANALYSIS AND MINING (BRASNAM), 10. , 2021, Evento Online. Anais [...]. Porto Alegre: Sociedade Brasileira de Computação, 2021 . p. 175-180. ISSN 2595-6094. DOI: https://doi.org/10.5753/brasnam.2021.16136",Twitter,corpus construído/coletado,"Twitterscraper, spacy, gensim","Remoção (links, hashtags, caracteres especiais, espaços, pontuações, stopwords)","Classificação (identificação de entidades), Modelagem de tópicos, Visualização (wordcloud)",Python,"LDA, Named Entity Recognition (NER), wordcloud","F1-Score, Revocação, Precisão",Não descrito,BraSNAM_2021
"NASCIMENTO, Rodolpho da Silva; SANTOS, Gabriel dos; CARVALHO, Flávio; GUEDES, Gustavo. Avaliando contribuições na substituição de termos informais em classificação de texto de redes sociais com NetSpeak-BR. In: BRAZILIAN WORKSHOP ON SOCIAL NETWORK ANALYSIS AND MINING (BRASNAM), 10. , 2021, Evento Online. Anais [...]. Porto Alegre: Sociedade Brasileira de Computação, 2021 . p. 181-186. ISSN 2595-6094. DOI: https://doi.org/10.5753/brasnam.2021.16137","Twitter, Youtube",corpus construído/coletado,"Netspeak, scikit-learn","Remoção (stopwords), lowercasing, tokenização",Classificação (identificação de polaridade),Python,"Support Vector Machine (SVM), Naive Bayes (NB), Random Forest (RF), TF-IDF, TF, teste de Wilcoxon","validação cruzada, F1-Score, teste qui-quadrado",Não descrito,BraSNAM_2021
"SANTOS, João Guilherme Bastos dos et al. Das milícias digitais ao comportamento coordenado: métodos interdisciplinares de análise e identificação de bots nas eleições brasileiras. In: BRAZILIAN WORKSHOP ON SOCIAL NETWORK ANALYSIS AND MINING (BRASNAM), 10. , 2021, Evento Online. Anais [...]. Porto Alegre: Sociedade Brasileira de Computação, 2021 . p. 187-192. ISSN 2595-6094. DOI: https://doi.org/10.5753/brasnam.2021.16138",Twitter,corpus construído/coletado,"ePOCS Twitter Crawler (eTC), Gephi, IRaMuTeQ",Não descrito,"Classificação (Análise de sentimentos, análise temporal, análise lexical), Modelagem de tópicos, clusterização",R,"Louvain, método Reinert, IRaMuTeQ",Não descrito,Não descrito,BraSNAM_2021
"SILVA, Márcio et al. Propaganda Eleitoral Antecipada: Uma Análise de Postagens em Mídias Sociais. In: BRAZILIAN WORKSHOP ON SOCIAL NETWORK ANALYSIS AND MINING (BRASNAM), 10. , 2021, Evento Online. Anais [...]. Porto Alegre: Sociedade Brasileira de Computação, 2021 . p. 199-204. ISSN 2595-6094. DOI: https://doi.org/10.5753/brasnam.2021.16140","twitter, facebook",corpus construído/coletado,"CrowdTangle, Botometer",Não descrito,"classificação (análise temporal, rotulagem de dados)",Python,Não descrito,Coeficiente Kappa de Cohen,Não descrito,BraSNAM_2021
"SALLES, Isadora A.; PAPPA, Gisele L.. Viés de Gênero em Biografias da Wikipédia em Português. In: BRAZILIAN WORKSHOP ON SOCIAL NETWORK ANALYSIS AND MINING (BRASNAM), 10. , 2021, Evento Online. Anais [...]. Porto Alegre: Sociedade Brasileira de Computação, 2021 . p. 211-216. ISSN 2595-6094. DOI: https://doi.org/10.5753/brasnam.2021.16142",Wikipédia,corpus construído/coletado,não descrito,"Remoção (stopwords, acentos, pontuações), tokenização","classificação (treinamento e teste de dados), Visualização (wordcloud)",Não descrito,"TF, Random Forest (RF), wordcloud, tf-idf, Naive Bayes (NB)","validação cruzada, F1-Score, Precisão, Revocação, PMI, teste qui-quadrado",Não descrito,BraSNAM_2021
"COUTINHO, Vinicius Matheus de Medeiros Silva; MALHEIROS, Yuri. Detecção de Mensagens Homofóbicas em Português no Twitter usando Análise de Sentimentos. In: BRAZILIAN WORKSHOP ON SOCIAL NETWORK ANALYSIS AND MINING (BRASNAM), 9. , 2020, Cuiabá. Anais [...]. Porto Alegre: Sociedade Brasileira de Computação, 2020 . p. 1-12. ISSN 2595-6094. DOI: https://doi.org/10.5753/brasnam.2020.11158",twitter,corpus construído/coletado,Scikit-learn,"Remoção (stopwords, links, acentos, pontuações), stemmization","Classificação (Análise de sentimentos, treinamento e teste de dados, identificação de polaridade, rotulagem de dados)",Python,"TF-IDF, Logistic Regression (LR), tash-pt","Acurácia, Precisão, F1-Score, Revocação, Fleiss Kappa",Não descrito,BraSNAM_2020
"SILVEIRA, Bárbara; DA SILVA, Ana Paula Couto; MURAI, Fabricio. Modelos de Previsão do Tom Emocional de Usuários em Comunidades de Saúde Mental no Reddit. In: BRAZILIAN WORKSHOP ON SOCIAL NETWORK ANALYSIS AND MINING (BRASNAM), 9. , 2020, Cuiabá. Anais [...]. Porto Alegre: Sociedade Brasileira de Computação, 2020 . p. 13-24. ISSN 2595-6094. DOI: https://doi.org/10.5753/brasnam.2020.11159",reddit,corpus construído/coletado,"Vader, ekphrasis, nltk, gensim","Remoção (stopwords, links, acentos, pontuações, espaços, caracteres especiais), stemmization, correção de textos","classificação (análise de sentimentos, identificação de polaridade), análise do tom emocional",Python,"Vader, Thread, word embeddings, Word2Vec, multi-layer perceptron (MLP)",Mean Squared Error (MSE),Não descrito,BraSNAM_2020
"COSTA, Raul Wagner Martins; PARDO, Thiago Alexandre Salgueiro. Métodos baseados em léxico para extração de aspectos de opiniões em português. In: BRAZILIAN WORKSHOP ON SOCIAL NETWORK ANALYSIS AND MINING (BRASNAM), 9. , 2020, Cuiabá. Anais [...]. Porto Alegre: Sociedade Brasileira de Computação, 2020 . p. 61-72. ISSN 2595-6094. DOI: https://doi.org/10.5753/brasnam.2020.11163",Não descrito,corpus já disponível,Enelvo,correção de textos,"classificação (extração de aspectos, treinamento e teste de dados, ontologia)",Não descrito,"word embeddings, Part-of-Speech tags (POS tags), word2vec","similaridade de cosseno, Precisão, F1-Score, revocação",https://sites.google.com/icmc.usp.br/opinando/,BraSNAM_2020
"BRAGA, M. Luísa P.; NAKAMURA, Fabíola G.; NAKAMURA, Eduardo F.. Criação e Caracterização de um Corpus de Discurso Sexista em Português. In: BRAZILIAN WORKSHOP ON SOCIAL NETWORK ANALYSIS AND MINING (BRASNAM), 9. , 2020, Cuiabá. Anais [...]. Porto Alegre: Sociedade Brasileira de Computação, 2020 . p. 97-107. ISSN 2595-6094. DOI: https://doi.org/10.5753/brasnam.2020.11166","G1, uol",corpus construído/coletado,scikit-learn,Não descrito,"Classificação (rotulagem de dados, treinamento e teste de dados)",Python,"Support Vector Machine (SVM), K-Nearest Neighbor (KNN), TF, grid search","Precisão, Revocação, F1-Score, validação cruzada",Não descrito,BraSNAM_2020
"NASCIMENTO, Rodolpho Silva; NASCIMENTO, Gabriel; CARVALHO, Flavio; GUEDES, Gustavo. Mineração de Opiniões com LIWC: abordagem prática sobre sistemas judiciais eletrônicos brasileiros. In: BRAZILIAN WORKSHOP ON SOCIAL NETWORK ANALYSIS AND MINING (BRASNAM), 9. , 2020, Cuiabá. Anais [...]. Porto Alegre: Sociedade Brasileira de Computação, 2020 . p. 132-141. ISSN 2595-6094. DOI: https://doi.org/10.5753/brasnam.2020.11169",Twitter,corpus construído/coletado,"WordCloud, nltk, LIWC","Remoção (stopwords, pontuações, links), lowercasing","Visualização (wordcloud), Classificação (extração de aspectos, identificação de polaridade, análise de sentimentos)",Python,"Named Entity Recognition (NER), WordCloud, LIWC",Não descrito,Não descrito,BraSNAM_2020
"DE SOUSA, Gustavo Nogueira; GUIMARÃES, Isabelle; JACOB JR, Antonio F. L.; LOBATO, Fábio M. F.. Análise comparativa das principais plataformas de reclamações online: implicações para análise de mídia social em negócios. In: BRAZILIAN WORKSHOP ON SOCIAL NETWORK ANALYSIS AND MINING (BRASNAM), 9. , 2020, Cuiabá. Anais [...]. Porto Alegre: Sociedade Brasileira de Computação, 2020 . p. 154-165. ISSN 2595-6094. DOI: https://doi.org/10.5753/brasnam.2020.11171","e-commerce, Consumidor.gov, ReclameAqui",corpus construído/coletado,scikit-learn,"Remoção (stopwords, pontuações, números, acentos, caracteres especiais, links)","Classificação (extração de características), Modelagem de tópicos",Python,LDA,"Flesch Readability Ease Score (FRES), PMI, coerência",Não descrito,BraSNAM_2020
"NOLASCO, Diogo; OLIVEIRA, Jonice. A Study of Rumor Detection based on Social Network Topic Models Relationship. In: BRAZILIAN WORKSHOP ON SOCIAL NETWORK ANALYSIS AND MINING (BRASNAM), 9. , 2020, Cuiabá. Anais [...]. Porto Alegre: Sociedade Brasileira de Computação, 2020 . p. 166-177. ISSN 2595-6094. DOI: https://doi.org/10.5753/brasnam.2020.11172","Twitter, PubMed",corpus construído/coletado,Não descrito,"Remoção (emojis, links, acentos)",Modelagem de tópicos,Python,LDA,KL-Divergence,Não descrito,BraSNAM_2020
"CAMARGOS, Ozório J.S.; PEREIRA, Adriano C. M.; BRANDÃO, Michele A.. Em Qual Portfólio Investir? Análise e Seleção a partir de dados do StockTwits. In: BRAZILIAN WORKSHOP ON SOCIAL NETWORK ANALYSIS AND MINING (BRASNAM), 9. , 2020, Cuiabá. Anais [...]. Porto Alegre: Sociedade Brasileira de Computação, 2020 . p. 184-189. ISSN 2595-6094",StockTwits,corpus construído/coletado,Não descrito,Limpeza dos dados,"análise estática, análise temporal, análise de correlação",Não descrito,Simulação de Monte Carlo,"Spearman, indice de sharpe",Não descrito,BraSNAM_2020
"GUIMARÃES, Eliseu; CARVALHO, Jonnathan; PAES, Aline; PLASTINO, Alexandre. Exploring model transfer strategies for sentiment analysis in Twitter. In: ENCONTRO NACIONAL DE INTELIGÊNCIA ARTIFICIAL E COMPUTACIONAL (ENIAC), 18. , 2021, Evento Online. Anais [...]. Porto Alegre: Sociedade Brasileira de Computação, 2021 . p. 1-12. ISSN 2763-9061. DOI: https://doi.org/10.5753/eniac.2021.18236",Twitter,corpus já disponível,Scikit-learn,"Remoção (menções, links), lowercasing, tokenização","Classificação (treinamento e teste de dados, análise de sentimentos, identificação de polaridade, balanceamento de dados)",Python,"word embeddings, word2vec, Logistic Regression (LR)","acurácia, F1-Score, similaridade de cosseno",Não descrito,ENIAC_2021
"SILVA, Ingrid L. A. da; MELLO, Rafael Ferreira; MIRANDA, Péricles B. C.; NASCIMENTO, André C. A.; MALDONADO, Isabel W. S.; COELHO FILHO, José L. M.. Assessment of text clustering approaches for legal documents. In: ENCONTRO NACIONAL DE INTELIGÊNCIA ARTIFICIAL E COMPUTACIONAL (ENIAC), 18. , 2021, Evento Online. Anais [...]. Porto Alegre: Sociedade Brasileira de Computação, 2021 . p. 37-48. ISSN 2763-9061. DOI: https://doi.org/10.5753/eniac.2021.18239",Sistema Judiciário,corpus construído/coletado,Não descrito,"Remoção (pontuações, números, outliers, stopwords), lemmatization","Clusterização, Classificação (extração de características)",Python,"TF-IDF, word embeddings, word2vec, Principal Component Analysis (PCA), K-Means (KM), Agglomerative clustering, Spectral clustering","índice de Calinski-Harabasz, índice de Davies-Bouldin, coeficiente de silhueta, Precisão, Revocação, F1-Score",Não descrito,ENIAC_2021
"FIGUERÊDO, José Solenir L.; ARAÚJO-CALUMBY, Renata F.; CALUMBY, Rodrigo T.. Machine Learning for Prognosis of Patients with COVID-19: An Early Days Analysis. In: ENCONTRO NACIONAL DE INTELIGÊNCIA ARTIFICIAL E COMPUTACIONAL (ENIAC), 18. , 2021, Evento Online. Anais [...]. Porto Alegre: Sociedade Brasileira de Computação, 2021 . p. 59-70. ISSN 2763-9061. DOI: https://doi.org/10.5753/eniac.2021.18241",opendatasus,corpus construído/coletado,Não descrito,Não descrito,"classificação (treinamento e teste de dados, balanceamento de dados)",Não descrito,"Decision Tree Classifier (DTC), Naive Bayes (NB)","Area Under the ROC Curve (AUC), validação cruzada",Não descrito,ENIAC_2021
"LIMA, Tiago Barbosa de; NASCIMENTO, André C. A.; MIRANDA, Pericles; MELLO, Rafael Ferreira. Analysis of a Brazilian Indigenous corpus using machine learning methods. In: ENCONTRO NACIONAL DE INTELIGÊNCIA ARTIFICIAL E COMPUTACIONAL (ENIAC), 18. , 2021, Evento Online. Anais [...]. Porto Alegre: Sociedade Brasileira de Computação, 2021 . p. 118-129. ISSN 2763-9061. DOI: https://doi.org/10.5753/eniac.2021.18246",Não descrito,corpus já disponível,scikit-learn,"Remoção (links, pontuações, símbolos, referêcias cruzadas), bigramas, trigramas","Classificação (classificação em língua indígena, extração de características, treinamento e teste de dados), tradução, clusterização, Visualização (t-SNE)",Python,"Logistic Regression (LR), Support Vector Machines (SVC), Naive Bayes (NB), K-Means (KM), t-SNE, TF-IDF, StratifiedKFold","acurácia, F1-Score, índice de Davies-Bouldin, coeficiente de silhueta, validação cruzada",Não descrito,ENIAC_2021
"MOTA, Caio C. R.; NASCIMENTO, André C. A.; MIRANDA, Péricles B. C.; MELLO, Rafael Ferreira; MALDONADO, Isabel W. S.; COELHO FILHO, José L. M.. Reconhecimento de entidades nomeadas em documentos jurídicos em português utilizando redes neurais. In: ENCONTRO NACIONAL DE INTELIGÊNCIA ARTIFICIAL E COMPUTACIONAL (ENIAC), 18. , 2021, Evento Online. Anais [...]. Porto Alegre: Sociedade Brasileira de Computação, 2021 . p. 130-140. ISSN 2763-9061. DOI: https://doi.org/10.5753/eniac.2021.18247",Sistema Judiciário,corpus construído/coletado,"Flair, spacy, tensorflow, keras, numpy, pandas, fasttext",Não descrito,"recuperação de informação, classificação (treinamento e teste de dados)",Python,"Named Entity Recognition (NER), BiLSTM-CRF, LSTM, CNN, CRF, word embeddings, optical character recognition (OCR), flair embeddings","F1-Score, Precisão, Revocação",Não descrito,ENIAC_2021
"ANDRADE, João Paulo A. et al. A Machine Learning-based System for Financial Fraud Detection. In: ENCONTRO NACIONAL DE INTELIGÊNCIA ARTIFICIAL E COMPUTACIONAL (ENIAC), 18. , 2021, Evento Online. Anais [...]. Porto Alegre: Sociedade Brasileira de Computação, 2021 . p. 165-176. ISSN 2763-9061. DOI: https://doi.org/10.5753/eniac.2021.18250",SEFAZ-ES,corpus já disponível,scikit-learn,redução de dimensionalidade,"classificação (treinamento e teste de dados, extração de características, rotulagem de dados)",Python,"K-Nearest Neighbor (KNN), Random Forest (RF), Support Vector Machine (SVM), Neural Network (NN), grid search","validação cruzada, F1-Score, Revocação, Precisão",Não descrito,ENIAC_2021
"BATISTA, Hyan H. N.; NASCIMENTO, André C. A.; MELO, Rafael Ferreira; MIRANDA, Péricles B. C.; MALDONADO, Isabel W. S.; COELHO FILHO, José L. M.. A comparative analysis of text embedding approach to extract named entities in Portuguese legal documents. In: ENCONTRO NACIONAL DE INTELIGÊNCIA ARTIFICIAL E COMPUTACIONAL (ENIAC), 18. , 2021, Evento Online. Anais [...]. Porto Alegre: Sociedade Brasileira de Computação, 2021 . p. 221-232. ISSN 2763-9061. DOI: https://doi.org/10.5753/eniac.2021.18255",Sistema Judiciário,corpus construído/coletado,Flair,Não descrito,"classificação (rotulagem de dados, treinamento e teste de dados)",Python,"BiLSTM-CRF, LSTM, optical character recognition (OCR), word embeddings, flair embeddings, character embedding, Pooled Contextualized Embedding, Glove, Named Entity Recognition (NER)","Revocação, Precisão, F1-Score",Não descrito,ENIAC_2021
"PINHEIRO, Breno David Lopes; SOUZA, Ellen Polliana Ramos; VITÓRIO, Douglas; ALBUQUERQUE, Hidelberg Oliveira. A Comparative Analysis of Machine Learning Named Entity Recognition Tools for the Brazilian and European Portuguese Language Variants. In: ENCONTRO NACIONAL DE INTELIGÊNCIA ARTIFICIAL E COMPUTACIONAL (ENIAC), 18. , 2021, Evento Online. Anais [...]. Porto Alegre: Sociedade Brasileira de Computação, 2021 . p. 244-255. ISSN 2763-9061. DOI: https://doi.org/10.5753/eniac.2021.18257",Não descrito,corpus já disponível,"OpenNLP, CoreNLP, spacy","Remoção (stopwords), tokenização, segmentação de sentenças","recuperação de informação, classificação (treinamento e teste de dados)",Python,Named Entity Recognition (NER),"validação cruzada, F1-Score, Revocação, Precisão",Não descrito,ENIAC_2021
"SANTOS, Jessica Almeida dos; BERTON, Lilian. Applying machine learning to assist the diagnosis of COVID-19 from blood and urine exams. In: ENCONTRO NACIONAL DE INTELIGÊNCIA ARTIFICIAL E COMPUTACIONAL (ENIAC), 18. , 2021, Evento Online. Anais [...]. Porto Alegre: Sociedade Brasileira de Computação, 2021 . p. 256-267. ISSN 2763-9061. DOI: https://doi.org/10.5753/eniac.2021.18258",Não descrito,corpus já disponível,scikit-learn,"remoção (outliers), redução de dimensionalidade, limpeza dos dados","classificação (balanceamento de dados, treinamento e teste de dados)",Python,"smote, undersampling e oversampling, K-Nearest Neighbor (KNN), Random Forest (RF), Support Vector Machine (SVM), Naive Bayes (NB), Logistic Regression (LR), Decision Tree Classifier (DTC), Gradient Boosting Machine (GBM), XGBoost, Extremely Randomized Trees (ERT)","F1-Score, acurácia, precisão, Revocação, Especificidade",Não descrito,ENIAC_2021
"CRUZ, Ramon Souza da; NUNES NETO, Gilberto; ANCHIÊTA, Rafael Torres. Detecting Misinformation in Tweets Related to COVID-19. In: ENCONTRO NACIONAL DE INTELIGÊNCIA ARTIFICIAL E COMPUTACIONAL (ENIAC), 18. , 2021, Evento Online. Anais [...]. Porto Alegre: Sociedade Brasileira de Computação, 2021 . p. 280-289. ISSN 2763-9061. DOI: https://doi.org/10.5753/eniac.2021.18260",Twitter,corpus construído/coletado,"snscrape, gensim, scikit-learn","remoção (stopwords, links, emojis), stemmization, lowercasing","classificação (rotulagem de dados, extração de características, treinamento e teste de dados), visualização (matriz de confusão)",Python,"TF-IDF, word embeddings, Paragraph Vector, Bag-of-words (BoW), Support Vector Machine (SVM), Naive Bayes (NB), Decision Tree Classifier (DTC), Neural Network (NN), multi-layer perceptron (MLP), RSLP Stemmer","validação cruzada, especificidade, Revocação, Precisão, F1-Score",https://github.com/Gungni/Akhasic,ENIAC_2021
